loknr,navn,status lokalitet,klareringsdato,klareringstype,kapasitet_lok,kapasitet enhet,plassering,vannmiljo,fylke,kommunenr,kommune,breddegrader,lengdegrader,arter,innehaver,akvakulturregister (intern),tillatelser,formål,produksjonsform,objectid,lokalitet,symbol,shape,x,y
11851,GYLAND,KLARERT,"oktober 31, 2001",PERMANENT,50000,STK,LAND,FERSKVANN,AGDER,4207,FLEKKEFJORD,58.38321,6.841635,"Laks, Regnbueørret, Røye, Ørret",HJELLESET  ROY,https://sikker.fiskeridir.no/aquareg/web/sites/11851,"VA-F-0002, AG-F-0002",COMMERCIAL,Settefisk,208781,11851 GYLAND,"Settefisk laks, ørret, regnbueørret",,6.841634999999997,58.38321000000002
11854,PINNEN,KLARERT,"oktober 1, 2001",PERMANENT,6240,TN,SJØ,SALTVANN,AGDER,4207,FLEKKEFJORD,58.221967,6.68495,"Laks, Regnbueørret, Ørret",MOWI ASA,https://sikker.fiskeridir.no/aquareg/web/sites/11854,"R-V-0018, VA-LD-0004, VA-F-0017, VA-FS-0010, VA-F-0018, R-V-0016, R-V-0017, R-HM-0005, R-HM-0007, VA-LD-0008",COMMERCIAL,Matfisk,208782,11854 PINNEN,"Matfisk laks, ørret, regnbueørret",,6.684950000000015,58.22196700000001
11856,SALVÅGVIKA,KLARERT,"mai 14, 1999",PERMANENT,7020,TN,SJØ,SALTVANN,AGDER,4207,FLEKKEFJORD,58.227167,6.632767,"Laks, Regnbueørret, Ørret",MOWI ASA,https://sikker.fiskeridir.no/aquareg/web/sites/11856,"VA-F-0015, R-V-0018, VA-F-0010, VA-F-0013, VA-F-0014, R-V-0016, R-V-0017, R-HM-0005, R-HM-0007",COMMERCIAL,Matfisk,208783,11856 SALVÅGVIKA,"Matfisk laks, ørret, regnbueørret",,6.632767000000001,58.22716700000001
11857,BUKSEVIKA,KLARERT,"juni 2, 1999",PERMANENT,4680,TN,SJØ,SALTVANN,AGDER,4207,FLEKKEFJORD,58.2074,6.63505,"Laks, Regnbueørret, Ørret","EIDE FJORDBRUK AS, MOWI ASA",https://sikker.fiskeridir.no/aquareg/web/sites/11857,"VA-F-0023, R-V-0018, VA-FS-0011, VA-FS-0010, VA-FS-0014, R-V-0016, R-V-0017, R-HM-0005, R-HM-0007",COMMERCIAL,Matfisk,208784,11857 BUKSEVIKA,"Matfisk laks, ørret, regnbueørret",,6.635049999999978,58.20740000000001
11861,SKIPNINGSDALEN,KLARERT,"februar 15, 1999",PERMANENT,6240,TN,SJØ,SALTVANN,AGDER,4207,FLEKKEFJORD,58.241483,6.5958,"Laks, Regnbueørret, Ørret",MOWI ASA,https://sikker.fiskeridir.no/aquareg/web/sites/11861,"VA-F-0004, VA-F-0005, R-V-0018, VA-F-0003, VA-LD-0010, R-V-0016, R-V-0017, R-HM-0005, R-HM-0007",COMMERCIAL,Matfisk,208785,11861 SKIPNINGSDALEN,"Matfisk laks, ørret, regnbueørret",,6.595799999999997,58.24148300000002
11864,NAPP,KLARERT,"oktober 14, 1999",PERMANENT,2340,TN,SJØ,SALTVANN,AGDER,4207,FLEKKEFJORD,58.248667,6.53675,"Laks, Regnbueørret, Ørret",MOWI ASA,https://sikker.fiskeridir.no/aquareg/web/sites/11864,"R-V-0018, R-V-0016, R-V-0017, R-HM-0005, R-HM-0007",COMMERCIAL,Matfisk,208786,11864 NAPP,"Matfisk laks, ørret, regnbueørret",,6.536749999999984,58.24866700000001
11879,KILAVÅGEN LAND,KLARERT,"oktober 30, 1991",PERMANENT,200000,STK,LAND,FERSKVANN,ROGALAND,1134,SULDAL,59.31735,6.288967,"Laks, Regnbueørret, Ørret",GRIEG SEAFOOD ROGALAND AS,https://sikker.fiskeridir.no/aquareg/web/sites/11879,"R-SD-0009, R-SD-0031, R-SD-0032, R-SD-0025",COMMERCIAL,"Settefisk, Stamfisk",208787,11879 KILAVÅGEN LAND,"Settefisk laks, ørret, regnbueørret",,6.288967000000014,59.317349999999976
11891,DIRDAL,KLARERT,"februar 10, 1992",PERMANENT,1300,KG,LAND,FERSKVANN/SALTVANN,ROGALAND,1122,GJESDAL,58.838733,6.18465,"Blåskjell, Edelkreps (ferskvann), Haneskjell, Harpeskjell, Kamskjell, O-skjell, Rutet teppeskjell, Sandskjell, Saueskjell, Østers",EWOS INNOVATION AS,https://sikker.fiskeridir.no/aquareg/web/sites/11891,R-G-0301,COMMERCIAL,Akvakulturdyr til konsum,208788,11891 DIRDAL,"Bløtdyr, krepsdyr, pigghuder",,6.184649999999976,58.83873299999999
11892,VÅGAFOSSEN,KLARERT,"desember 29, 1998",PERMANENT,0,STK,LAND,FERSKVANN,ROGALAND,1160,VINDAFJORD,59.479133,6.130183,"Laks, Regnbueørret, Ørret",MOWI ASA,https://sikker.fiskeridir.no/aquareg/web/sites/11892,R-V-0003,COMMERCIAL,Settefisk,208789,11892 VÅGAFOSSEN,"Settefisk laks, ørret, regnbueørret",,6.130182999999988,59.47913299999999
11893,FOSSÅ,KLARERT,"januar 4, 1996",PERMANENT,3600,TN,SJØ,SALTVANN,ROGALAND,1133,HJELMELAND,59.2699,6.14295,"Laks, Regnbueørret, Ørret","CENTRE FOR AQUACULTURE COMPETENCE AS, MOWI ASA",https://sikker.fiskeridir.no/aquareg/web/sites/11893,"R-TV-0002, R-HM-0002, R-F-0003, R-HM-0029, R-F-0041, R-HM-0008, R-HM-0003, R-HM-0020","COMMERCIAL, RESEARCH",Matfisk,208790,11893 FOSSÅ,"Matfisk laks, ørret, regnbueørret",,6.142949999999985,59.26990000000001
11894,EIANE,KLARERT,"juni 3, 2009",PERMANENT,2400000,STK,LAND,FERSKVANN,ROGALAND,1108,SANDNES,58.95784,6.172617,"Laks, Regnbueørret, Ørret",LERØY VEST AS,https://sikker.fiskeridir.no/aquareg/web/sites/11894,R-FD-0003,COMMERCIAL,Settefisk,208791,11894 EIANE,"Settefisk laks, ørret, regnbueørret",,6.1726170000000025,58.957839999999976
11899,MJÅVATNET,KLARERT,"januar 10, 2000",PERMANENT,65,TN,LAND,FERSKVANN,ROGALAND,1114,BJERKREIM,58.631471,6.162993,"Røye, Ørret",NORSK ØRRET AS,https://sikker.fiskeridir.no/aquareg/web/sites/11899,R-BR-0001,COMMERCIAL,Matfisk,208792,11899 MJÅVATNET,"Matfisk laks, ørret, regnbueørret",,6.162992999999972,58.631470999999976
11903,VIGANESET V,KLARERT,"mars 10, 1999",PERMANENT,24,DA,SJØ,SALTVANN,ROGALAND,1108,SANDNES,58.94315,6.12205,"Blåskjell, Drøbaksjøpiggsvin, Langpigget kråkebolle",LYSEFJORDEN SKJELL OG KRÅKEBOLLER AS,https://sikker.fiskeridir.no/aquareg/web/sites/11903,"R-FD-0321, R-FD-0322, R-FD-0323",COMMERCIAL,Akvakulturdyr til konsum,208793,11903 VIGANESET V,"Bløtdyr, krepsdyr, pigghuder",,6.1220500000000015,58.94315
11907,GRÅTNES,KLARERT,"juli 2, 1998",PERMANENT,1000,TN,SJØ,SALTVANN,ROGALAND,1108,SANDNES,58.87195,6.123217,"Laks, Regnbueørret, Ørret",EWOS INNOVATION AS,https://sikker.fiskeridir.no/aquareg/web/sites/11907,"R-G-0013, R-G-0010",RESEARCH,Matfisk,208794,11907 GRÅTNES,Særtillatelser,,6.123217000000011,58.87195000000003
11908,OLTESVIK,KLARERT,"juli 2, 1998",PERMANENT,910,TN,SJØ,SALTVANN,ROGALAND,1122,GJESDAL,58.854917,6.124417,"Laks, Regnbueørret, Ørret",EWOS INNOVATION AS,https://sikker.fiskeridir.no/aquareg/web/sites/11908,"R-G-0013, R-G-0010",RESEARCH,Matfisk,208795,11908 OLTESVIK,Særtillatelser,,6.124416999999994,58.854917
11913,KJEAHOLA,KLARERT,"august 22, 2000",PERMANENT,7020,TN,SJØ,SALTVANN,ROGALAND,1103,STAVANGER,59.2933,6.0729,"Laks, Regnbueørret, Ørret",MOWI ASA,https://sikker.fiskeridir.no/aquareg/web/sites/11913,"R-TV-0002, R-HM-0002, R-F-0003, R-ST-0001, R-TV-0004, R-HM-0008, R-HM-0003, R-V-0004, R-HM-0001, R-F-0005",COMMERCIAL,Matfisk,208796,11913 KJEAHOLA,"Matfisk laks, ørret, regnbueørret",,6.072900000000004,59.29329999999999
11920,HERØY,KLARERT,"juni 7, 2001",PERMANENT,3600,TN,SJØ,SALTVANN,ROGALAND,1160,VINDAFJORD,59.46635,6.0258,"Laks, Regnbueørret, Ørret",MOWI ASA,https://sikker.fiskeridir.no/aquareg/web/sites/11920,"R-TV-0002, R-HM-0002, R-F-0003, R-ST-0001, R-V-0011, R-TV-0004, R-HM-0008, R-HM-0003, R-V-0004, R-HM-0001, R-F-0005",COMMERCIAL,Matfisk,208797,11920 HERØY,"Matfisk laks, ørret, regnbueørret",,6.025800000000004,59.46634999999998
11921,OANES LAND,KLARERT,"april 26, 2000",PERMANENT,9.75,TN,LAND,SALTVANN,ROGALAND,1130,STRAND,58.908999,6.075991,"Berggylt, Bergnebb, Brosme, Brungylt, Gressgylt, Gråsteinbit, Grønngylt, Hvitting, Hyse, Kveite, Laks, Lange, Liten kantnål, Lusuer, Lyr, Paddetorsk, Pigghå, Piggskate, Regnbueørret, Rognkjeks (felles), Rødspette, Sei, Skrubbe, Stor kantnål, Torsk, Ål, Ørret","LYSEFJORDSENTERET AS, RYFISH AS",https://sikker.fiskeridir.no/aquareg/web/sites/11921,"R-FD-0012, R-FD-0011","COMMERCIAL, RECREATION",Matfisk,208798,11921 OANES LAND,"Matfisk laks, ørret, regnbueørret",,6.075990999999988,58.908998999999994
11922,OANES SJØ,KLARERT,"april 26, 2000",PERMANENT,780,TN,SJØ,SALTVANN,ROGALAND,1130,STRAND,58.910083,6.079483,"Laks, Regnbueørret, Ørret","GRIEG SEAFOOD ROGALAND AS, RYFISH AS",https://sikker.fiskeridir.no/aquareg/web/sites/11922,"R-B-0003, R-FD-0017, R-FD-0011","COMMERCIAL, RECREATION, RESEARCH",Matfisk,208799,11922 OANES SJØ,"Matfisk laks, ørret, regnbueørret",,6.079482999999982,58.910082999999986
11925,VINTRAVIKI,KLARERT,"august 25, 2000",PERMANENT,520,TN,SJØ,SALTVANN,ROGALAND,1134,SULDAL,59.399383,6.020533,"Laks, Regnbueørret, Ørret",ROGALAND FJORDBRUK AS,https://sikker.fiskeridir.no/aquareg/web/sites/11925,R-SS-0017,COMMERCIAL,Matfisk,208800,11925 VINTRAVIKI,"Matfisk laks, ørret, regnbueørret",,6.020533,59.399383
11927,LERANGSVÅGEN LAND,KLARERT,"februar 26, 1997",PERMANENT,100,TN,LAND,FERSKVANN/SALTVANN,ROGALAND,1108,SANDNES,58.935076,6.037278,"Laks, Regnbueørret, Torsk, Ørret",SKRETTING AQUACULTURE RESEARCH CENTRE AS,https://sikker.fiskeridir.no/aquareg/web/sites/11927,"R-FD-0004, R-FD-0014, R-FD-0013","COMMERCIAL, RESEARCH","Matfisk, Settefisk",208801,11927 LERANGSVÅGEN LAND,Særtillatelser,,6.037278000000015,58.93507599999998
11928,LANGAVIKA,KLARERT,"juli 10, 1998",PERMANENT,6720,TN,SJØ,SALTVANN,ROGALAND,1103,STAVANGER,59.230767,6.004483,"Laks, Regnbueørret, Ørret",MOWI ASA,https://sikker.fiskeridir.no/aquareg/web/sites/11928,"R-TV-0002, R-HM-0002, R-F-0003, R-ST-0001, R-V-0011, R-TV-0004, R-HM-0008, R-HM-0003, R-V-0004, R-HM-0001, R-F-0005",COMMERCIAL,Matfisk,208802,11928 LANGAVIKA,"Matfisk laks, ørret, regnbueørret",,6.004482999999993,59.230767000000014
11930,BJELKAVIK,KLARERT,"september 14, 2000",PERMANENT,3900,TN,SJØ,SALTVANN,ROGALAND,1134,SULDAL,59.45165,5.991917,"Laks, Regnbueørret, Ørret","EWOS INNOVATION AS, ROGALAND FJORDBRUK AS",https://sikker.fiskeridir.no/aquareg/web/sites/11930,"R-SD-0005, R-G-0013, R-SD-0003, R-R-0009, R-FD-0005, R-G-0010, R-TV-0001, R-SD-0021, R-SD-0033, R-SS-0017","COMMERCIAL, RESEARCH",Matfisk,208803,11930 BJELKAVIK,"Matfisk laks, ørret, regnbueørret",,5.991917000000001,59.45164999999997
11939,SMAL SKAR,KLARERT,"november 21, 1997",PERMANENT,2340,TN,SJØ,SALTVANN,ROGALAND,1103,STAVANGER,59.2051,5.966083,"Laks, Regnbueørret, Ørret",EIDESVIK LAKS AS,https://sikker.fiskeridir.no/aquareg/web/sites/11939,"R-SD-0001, R-SD-0011, R-S-0003, R-F-0006, R-R-0007",COMMERCIAL,Matfisk,208804,11939 SMAL SKAR,"Matfisk laks, ørret, regnbueørret",,5.966083000000026,59.205100000000016
11952,HELLAND,KLARERT,"februar 13, 1997",PERMANENT,780,TN,LAND,SALTVANN,ROGALAND,1134,SULDAL,59.431004,5.916402,Kveite,STERLING WHITE HALIBUT AS,https://sikker.fiskeridir.no/aquareg/web/sites/11952,R-SD-0017,COMMERCIAL,Matfisk,208805,11952 HELLAND,Andre,,5.916402000000005,59.43100399999997
11954,IMS II,KLARERT,"februar 27, 1996",PERMANENT,130,TN,LAND,FERSKVANN/SALTVANN,ROGALAND,1108,SANDNES,58.903709,5.963545,"Berggylt, Bergnebb, Blåskjell, Brisling, Drøbaksjøpiggsvin, Edelkreps (ferskvann), Flekksteinbit, Gressgylt, Gråsteinbit, Grønngylt, Hummer, Kamskjell, Kveite, Laks, Langpigget kråkebolle, Leirkutling, Liten kantnål, Lyr, O-skjell, Piggvar, Regnbueørret, Rød kråkebolle, Rødspette, Sandkutling, Sei, Sild, Sjøkreps, Småsil, Stingsild, Storsil, Strandsnegl, Svartkutling, Tangkutling, Taskekrabbe, Torsk, Ål, Ørret, Østers",STIFTELSEN NORSK INSTITUTT FOR NATURFORSKNING NINA,https://sikker.fiskeridir.no/aquareg/web/sites/11954,"R-SS-0021, R-SS-0009, R-SS-0020, R-SS-0024, R-SS-0025, R-SS-0316","COMMERCIAL, RESEARCH","Akvakulturdyr i tidlige livsstadier, Matfisk, Settefisk",208806,11954 IMS II,"Matfisk laks, ørret, regnbueørret",,5.9635450000000105,58.90370899999999
11957,INDRE SLETTAVIKNESET,KLARERT,"april 26, 2000",PERMANENT,2340,TN,SJØ,SALTVANN,ROGALAND,1108,SANDNES,58.954133,5.947817,"Laks, Regnbueørret, Ørret",BREMNES SEASHORE AS,https://sikker.fiskeridir.no/aquareg/web/sites/11957,"R-SS-0018, R-ST-0012, R-FD-0016, R-V-0001, R-SS-0008",COMMERCIAL,Matfisk,208807,11957 INDRE SLETTAVIKNESET,"Matfisk laks, ørret, regnbueørret",,5.947816999999986,58.95413300000001
11961,TAUVÅGEN,KLARERT,"august 20, 1993",PERMANENT,2490000,STK,LAND,FERSKVANN,ROGALAND,1130,STRAND,59.061577,5.912968,"Laks, Regnbueørret, Ørret",VESTLIE AS,https://sikker.fiskeridir.no/aquareg/web/sites/11961,R-ST-0004,COMMERCIAL,Settefisk,208808,11961 TAUVÅGEN,"Settefisk laks, ørret, regnbueørret",,5.912967999999978,59.061577
11964,RINGJA,KLARERT,"april 17, 1998",PERMANENT,4680,TN,SJØ,SALTVANN,ROGALAND,1146,TYSVÆR,59.405467,5.8631,"Laks, Regnbueørret, Ørret","FINNØY FISK AS, MOWI ASA",https://sikker.fiskeridir.no/aquareg/web/sites/11964,"R-TV-0002, R-TV-0004, R-HM-0008, R-F-0030, R-F-0001, R-HM-0001",COMMERCIAL,Matfisk,208809,11964 RINGJA,"Matfisk laks, ørret, regnbueørret",,5.863099999999974,59.40546699999999
11966,SKIGELSTRAND,KLARERT,"september 28, 2001",PERMANENT,2340,TN,SJØ,SALTVANN,ROGALAND,1160,VINDAFJORD,59.494117,5.846567,Regnbueørret,OSLAND STAMFISK AS,https://sikker.fiskeridir.no/aquareg/web/sites/11966,"SF-HØ-0020, R-V-0027, R-V-0023",COMMERCIAL,Stamfisk,208810,11966 SKIGELSTRAND,"Stamfisk laks, ørret, regnbueørret",,5.846566999999993,59.49411700000002
11969,HELGØY,KLARERT,"september 19, 2001",PERMANENT,600,TN,SJØ,SALTVANN,ROGALAND,1103,STAVANGER,59.226617,5.853783,"Laks, Regnbueørret, Ørret",GRIEG SEAFOOD ROGALAND AS,https://sikker.fiskeridir.no/aquareg/web/sites/11969,R-F-0018,SLAUGHTER PEN,Matfisk,208811,11969 HELGØY,Slaktemerd,,5.853783000000021,59.226616999999976
11971,STORE TEISTHOLMEN Ø,KLARERT,"juli 6, 2001",PERMANENT,3120,TN,SJØ,SALTVANN,ROGALAND,1108,SANDNES,58.977767,5.867,"Laks, Regnbueørret, Ørret","GRIEG SEAFOOD ROGALAND AS, ROGALAND FYLKESKOMMUNE, SKRETTING AS",https://sikker.fiskeridir.no/aquareg/web/sites/11971,"R-B-0005, R-B-0003, R-SS-0005, R-SS-0010, R-F-0002, R-R-0002, R-S-0002, R-B-0013, R-ST-0015, R-S-0001","COMMERCIAL, EDUCATION, RESEARCH",Matfisk,208812,11971 STORE TEISTHOLMEN Ø,"Matfisk laks, ørret, regnbueørret",,5.867000000000019,58.97776699999997
11972,PRESTHOLMANE,KLARERT,"juli 6, 2001",PERMANENT,3120,TN,SJØ,SALTVANN,ROGALAND,1103,STAVANGER,59.116767,5.8545,"Laks, Regnbueørret, Ørret",BREMNES SEASHORE AS,https://sikker.fiskeridir.no/aquareg/web/sites/11972,"R-ST-0012, R-FD-0016, R-SS-0008, R-ST-0002, R-SS-0011",COMMERCIAL,Matfisk,208813,11972 PRESTHOLMANE,"Matfisk laks, ørret, regnbueørret",,5.854499999999973,59.11676699999998
11976,HINDERÅVÅG,KLARERT,"januar 10, 2000",PERMANENT,60,TN,LAND,SALTVANN,ROGALAND,1146,TYSVÆR,59.350969,5.802245,Rognkjeks (felles),RYFYLKE RENSEFISK AS,https://sikker.fiskeridir.no/aquareg/web/sites/11976,"R-TV-0030, R-TV-0031",COMMERCIAL,"Settefisk, Stamfisk",208814,11976 HINDERÅVÅG,Andre,,5.802245000000028,59.35096900000002
12003,ROSSHOLMEN N,KLARERT,"mars 22, 2006",PERMANENT,3600,TN,SJØ,SALTVANN,ROGALAND,1103,STAVANGER,59.064283,5.722617,"Laks, Regnbueørret, Ørret","EWOS INNOVATION AS, ROGALAND FJORDBRUK AS",https://sikker.fiskeridir.no/aquareg/web/sites/12003,"R-SD-0005, R-G-0013, R-SD-0003, R-R-0009, R-FD-0005, R-G-0010, R-TV-0001, R-SD-0021, R-SD-0033, R-SS-0017","COMMERCIAL, RESEARCH",Matfisk,208815,12003 ROSSHOLMEN N,"Matfisk laks, ørret, regnbueørret",,5.722617000000014,59.06428299999999
12007,DALE II,KLARERT,"juni 26, 2001",PERMANENT,1560,TN,SJØ,SALTVANN,ROGALAND,1103,STAVANGER,59.08215,5.71055,"Laks, Regnbueørret, Ørret","GRIEG SEAFOOD ROGALAND AS, SKRETTING AS",https://sikker.fiskeridir.no/aquareg/web/sites/12007,"R-KV-0001, R-KV-0002, R-R-0010, R-R-0002, R-B-0013, R-S-0002, R-S-0001","COMMERCIAL, RESEARCH",Matfisk,208816,12007 DALE II,"Matfisk laks, ørret, regnbueørret",,5.710550000000012,59.08215000000001
12011,HÅØYA NØ,KLARERT,"august 22, 2000",PERMANENT,2340,TN,SJØ,SALTVANN,ROGALAND,1146,TYSVÆR,59.290417,5.6765,"Laks, Regnbueørret, Ørret","FJELBERG FJORDBRUK  AS, ROGALAND FJORDBRUK AS, RØVÆR FJORDBRUK AS, SUNNHORDLAND FJORDBRUK AS, TOFTØY FJORDBRUK AS",https://sikker.fiskeridir.no/aquareg/web/sites/12011,"R-SD-0005, R-TV-0006, R-SD-0003, R-TV-0003, H-K-0051, R-R-0009, R-FD-0005, R-H-0003, R-SD-0033, R-TV-0001, R-SD-0021, H-K-0062, H-K-0034, R-SS-0017",COMMERCIAL,Matfisk,208817,12011 HÅØYA NØ,"Matfisk laks, ørret, regnbueørret",,5.676499999999976,59.29041699999999
12018,ROSSHOLMEN,KLARERT,"juli 1, 1998",PERMANENT,500,TN,SJØ,SALTVANN,VESTLAND,4622,KVAM,60.394683,6.274833,"Laks, Regnbueørret, Ørret",LINGALAKS AS,https://sikker.fiskeridir.no/aquareg/web/sites/12018,"H-KM-0024, H-KM-0004, H-KM-0005, H-KM-0001, H-KM-0018","COMMERCIAL, EXHIBITION",Matfisk,208818,12018 ROSSHOLMEN,"Matfisk laks, ørret, regnbueørret",,6.274833000000001,60.394682999999986
12019,SALTKJELEN II,KLARERT,"mai 3, 2000",PERMANENT,2145,TN,SJØ,SALTVANN,VESTLAND,4618,ULLENSVANG,60.248017,6.2014,"Laks, Regnbueørret, Ørret","BREMNES SEASHORE AS, NOFIMA AS",https://sikker.fiskeridir.no/aquareg/web/sites/12019,"H-K-0040, H-MF-0032, H-B-0005, H-MF-0033, H-MF-0034, H-J-0003","COMMERCIAL, RESEARCH",Matfisk,208819,12019 SALTKJELEN II,"Matfisk laks, ørret, regnbueørret",,6.201399999999978,60.248017000000004
12020,OLDERHOLA,KLARERT,"august 7, 2001",PERMANENT,154,DA,SJØ,SALTVANN,VESTLAND,4617,KVINNHERAD,60.114117,6.190267,"Blåskjell, Butare, Fingertare, Fjærehinne uspes, Havsalat, Sukkertare, Søl",LERØY VEST AS,https://sikker.fiskeridir.no/aquareg/web/sites/12020,"H-K-0904, H-K-0902, H-K-0905, H-K-0906, H-K-0357, H-K-0901, H-K-0903",COMMERCIAL,"Akvakulturdyr i tidlige livsstadier, Alger til konsum",208820,12020 OLDERHOLA,"Bløtdyr, krepsdyr, pigghuder",,6.190267000000006,60.11411700000002
12022,LJONESBJØRGENE,KLARERT,"oktober 2, 1999",PERMANENT,3120,TN,SJØ,SALTVANN,VESTLAND,4622,KVAM,60.2564,6.16585,"Laks, Regnbueørret, Ørret","AUSTEVOLL MELAKS AS, LINGALAKS AS",https://sikker.fiskeridir.no/aquareg/web/sites/12022,"H-AV-0027, H-KM-0004, H-KM-0005, H-KM-0001, H-KM-0018",COMMERCIAL,Matfisk,208821,12022 LJONESBJØRGENE,"Matfisk laks, ørret, regnbueørret",,6.165849999999978,60.256399999999985
12023,HUNDASVOSKJERET,KLARERT,"april 10, 2001",PERMANENT,110,DA,SJØ,SALTVANN,VESTLAND,4617,KVINNHERAD,60.11175,6.17085,"Blåskjell, Butare, Fingertare, Fjærehinne uspes, Havsalat, Sukkertare, Søl",LERØY VEST AS,https://sikker.fiskeridir.no/aquareg/web/sites/12023,"H-K-0912, H-K-0908, H-K-0358, H-K-0909, H-K-0907, H-K-0911, H-K-0910",COMMERCIAL,"Akvakulturdyr i tidlige livsstadier, Alger til konsum",208822,12023 HUNDASVOSKJERET,"Bløtdyr, krepsdyr, pigghuder",,6.170849999999973,60.11174999999997
12032,ØYERHAMN,KLARERT,"mars 27, 2001",PERMANENT,2500000,STK,LAND,FERSKVANN,VESTLAND,4617,KVINNHERAD,60.159516,5.983567,"Laks, Regnbueørret, Ørret",MOWI ASA,https://sikker.fiskeridir.no/aquareg/web/sites/12032,H-K-0006,COMMERCIAL,Settefisk,208823,12032 ØYERHAMN,"Settefisk laks, ørret, regnbueørret",,5.983566999999994,60.159515999999996
12033,DYSVIK,KLARERT,"mai 18, 2001",PERMANENT,2340,TN,SJØ,SALTVANN,VESTLAND,4622,KVAM,60.191017,5.967617,"Laks, Regnbueørret, Ørret","QUATRO LAKS AS, TOMBRE FISKEANLEGG AS",https://sikker.fiskeridir.no/aquareg/web/sites/12033,"H-SO-0002, H-KM-0009",COMMERCIAL,Matfisk,208824,12033 DYSVIK,"Matfisk laks, ørret, regnbueørret",,5.967617000000018,60.19101699999999
12035,HONDSKÅR,KLARERT,"juni 26, 2001",PERMANENT,2340,TN,SJØ,SALTVANN,VESTLAND,4617,KVINNHERAD,60.106867,5.939133,"Laks, Regnbueørret, Ørret","AUSTEVOLL MELAKS AS, EIDE FJORDBRUK AS, EWOS INNOVATION AS, FYLKESNES FISK AS",https://sikker.fiskeridir.no/aquareg/web/sites/12035,"H-FJ-0005, H-K-0032, H-B-0009, H-AV-0006, H-O-0005, H-B-0021, H-K-0033","COMMERCIAL, RESEARCH",Matfisk,208825,12035 HONDSKÅR,"Matfisk laks, ørret, regnbueørret",,5.939133000000027,60.10686700000002
12036,HISDALEN,KLARERT,"juni 26, 2001",PERMANENT,2340,TN,SJØ,SALTVANN,VESTLAND,4617,KVINNHERAD,60.126117,5.9305,"Laks, Regnbueørret, Ørret","AUSTEVOLL MELAKS AS, EIDE FJORDBRUK AS, EWOS INNOVATION AS",https://sikker.fiskeridir.no/aquareg/web/sites/12036,"H-AV-0006, H-O-0005, H-K-0033, H-K-0032","COMMERCIAL, RESEARCH",Matfisk,208826,12036 HISDALEN,"Matfisk laks, ørret, regnbueørret",,5.930499999999995,60.12611700000002
12040,BRANDASKUTA,KLARERT,"juni 26, 2001",PERMANENT,2340,TN,SJØ,SALTVANN,VESTLAND,4617,KVINNHERAD,59.975733,5.909183,"Laks, Regnbueørret, Ørret","AUSTEVOLL MELAKS AS, EIDE FJORDBRUK AS, TELAVÅG FISKEOPPDRETT AS",https://sikker.fiskeridir.no/aquareg/web/sites/12040,"H-K-0032, H-S-0023, H-AV-0027, H-K-0033, H-S-0006",COMMERCIAL,Matfisk,208827,12040 BRANDASKUTA,"Matfisk laks, ørret, regnbueørret",,5.9091829999999845,59.97573299999999
12041,EIDESTØ,KLARERT,"oktober 9, 1997",PERMANENT,105,TN,LAND,FERSKVANN,VESTLAND,4624,BJØRNAFJORDEN,60.226498,5.873567,"Laks, Regnbueørret, Ørret",K J EIDE FISKEOPPDRETT AS,https://sikker.fiskeridir.no/aquareg/web/sites/12041,H-FS-0038,COMMERCIAL,Settefisk,208828,12041 EIDESTØ,"Settefisk laks, ørret, regnbueørret",,5.87356699999998,60.22649799999999
12042,SKOGSEIDVATNET,KLARERT,"mai 18, 2001",PERMANENT,715000,STK,SJØ,FERSKVANN,VESTLAND,4624,BJØRNAFJORDEN,60.201884,5.873171,"Laks, Regnbueørret, Ørret",TOMBRE FISKEANLEGG AS,https://sikker.fiskeridir.no/aquareg/web/sites/12042,H-FS-0035,COMMERCIAL,Settefisk,208829,12042 SKOGSEIDVATNET,"Settefisk laks, ørret, regnbueørret",,5.8731710000000135,60.20188400000001
12047,MJÅNESET,KLARERT,"februar 27, 2001",PERMANENT,1560,TN,SJØ,SALTVANN,VESTLAND,4624,BJØRNAFJORDEN,60.1763,5.7231,"Laks, Regnbueørret, Ørret",AS BOLAKS,https://sikker.fiskeridir.no/aquareg/web/sites/12047,"H-FS-0040, H-FS-0004, H-FS-0017, H-FS-0014, H-FS-0010, H-FS-0037, H-FS-0001, H-FS-0026, H-FS-0006, H-O-0012, H-R-0003, H-O-0013",COMMERCIAL,"Matfisk, Stamfisk",208830,12047 MJÅNESET,"Matfisk laks, ørret, regnbueørret",,5.723099999999988,60.176300000000026
12048,SKIFTESNESET N,KLARERT,"januar 2, 1996",PERMANENT,3120,TN,SJØ,SALTVANN,VESTLAND,4624,BJØRNAFJORDEN,60.0711,5.736867,"Laks, Regnbueørret, Ørret",AS BOLAKS,https://sikker.fiskeridir.no/aquareg/web/sites/12048,"H-FS-0040, H-FS-0004, H-FS-0017, H-FS-0014, H-FS-0010, H-FS-0037, H-FS-0001, H-FS-0026, H-FS-0006, H-O-0012, H-R-0003, H-O-0013",COMMERCIAL,"Matfisk, Stamfisk",208831,12048 SKIFTESNESET N,"Matfisk laks, ørret, regnbueørret",,5.736867000000018,60.0711
12067,ALDALEN,KLARERT,"november 17, 2000",PERMANENT,1560,TN,SJØ,SALTVANN,VESTLAND,4624,BJØRNAFJORDEN,60.24995,5.571917,"Laks, Regnbueørret, Ørret",AS BOLAKS,https://sikker.fiskeridir.no/aquareg/web/sites/12067,"H-FS-0040, H-FS-0017, H-FS-0014, H-FS-0010, H-FS-0037, H-FS-0001, H-FS-0026, H-FS-0006, H-O-0012, H-R-0003, H-O-0013",COMMERCIAL,"Matfisk, Stamfisk",208832,12067 ALDALEN,"Matfisk laks, ørret, regnbueørret",,5.571916999999985,60.24995000000001
12071,OMMUNDSTEIGEN,KLARERT,"mars 22, 1999",PERMANENT,1040,TN,SJØ,SALTVANN,ROGALAND,1134,SULDAL,59.550783,6.5131,"Laks, Regnbueørret, Ørret",GRIEG SEAFOOD ROGALAND AS,https://sikker.fiskeridir.no/aquareg/web/sites/12071,"R-SD-0008, R-SD-0025","COMMERCIAL, RESEARCH","Matfisk, Stamfisk",208833,12071 OMMUNDSTEIGEN,Særtillatelser,,6.5131000000000085,59.550783000000024
12073,FJÆRA,KLARERT,"mars 21, 2014",PERMANENT,7500000,STK,LAND,FERSKVANN/SALTVANN,VESTLAND,4611,ETNE,59.874033,6.386467,"Laks, Regnbueørret, Ørret",MOWI ASA,https://sikker.fiskeridir.no/aquareg/web/sites/12073,H-E-0028,COMMERCIAL,Settefisk,208834,12073 FJÆRA,"Settefisk laks, ørret, regnbueørret",,6.386466999999982,59.874033
12074,SVÅSANDNESET,KLARERT,"august 10, 1992",PERMANENT,3120,TN,SJØ,SALTVANN,VESTLAND,4618,ULLENSVANG,60.324217,6.318983,"Laks, Regnbueørret, Ørret",MOWI ASA,https://sikker.fiskeridir.no/aquareg/web/sites/12074,"H-J-0005, H-F-0007, H-F-0009, H-K-0037, H-F-0010, H-K-0039, H-F-0011, H-J-0004, H-E-0005, H-F-0008, H-K-0028",COMMERCIAL,Matfisk,208835,12074 SVÅSANDNESET,"Matfisk laks, ørret, regnbueørret",,6.318983000000003,60.324216999999976
12075,SUNDAL,KLARERT,"juni 4, 1999",PERMANENT,2000000,STK,LAND,FERSKVANN,VESTLAND,4617,KVINNHERAD,60.117144,6.266499,"Laks, Regnbueørret, Ørret",SJØTROLL HAVBRUK AS,https://sikker.fiskeridir.no/aquareg/web/sites/12075,H-K-0011,COMMERCIAL,Settefisk,208836,12075 SUNDAL,"Settefisk laks, ørret, regnbueørret",,6.26649900000001,60.117143999999996
12077,TVEITNESVIK,KLARERT,"august 22, 1994",PERMANENT,1560,TN,SJØ,SALTVANN,VESTLAND,4617,KVINNHERAD,60.105917,6.20525,Regnbueørret,SJØTROLL HAVBRUK AS,https://sikker.fiskeridir.no/aquareg/web/sites/12077,"H-OR-0017, H-L-0022",COMMERCIAL,Stamfisk,208837,12077 TVEITNESVIK,"Stamfisk laks, ørret, regnbueørret",,6.205249999999978,60.10591699999998
12078,GANGDAL,KLARERT,"juni 25, 1991",PERMANENT,1560,TN,SJØ,SALTVANN,VESTLAND,4618,ULLENSVANG,60.2165,6.15785,"Laks, Regnbueørret, Ørret",ERKO SEAFOOD AS,https://sikker.fiskeridir.no/aquareg/web/sites/12078,"H-SO-0010, H-J-0007, H-KM-0014",COMMERCIAL,Matfisk,208838,12078 GANGDAL,"Matfisk laks, ørret, regnbueørret",,6.157849999999996,60.216499999999996
12079,LJONESVÅGEN,KLARERT,"oktober 9, 1997",PERMANENT,1500000,STK,LAND,FERSKVANN,VESTLAND,4622,KVAM,60.259533,6.1413,"Laks, Regnbueørret, Ørret",BIOFISH AS,https://sikker.fiskeridir.no/aquareg/web/sites/12079,H-KM-0012,COMMERCIAL,Settefisk,208839,12079 LJONESVÅGEN,"Settefisk laks, ørret, regnbueørret",,6.141300000000001,60.259532999999976
12081,STRAUMNESET,KLARERT,"oktober 2, 1999",PERMANENT,1560,TN,SJØ,SALTVANN,VESTLAND,4618,ULLENSVANG,60.221333,6.140133,"Laks, Regnbueørret, Ørret",ERKO SEAFOOD AS,https://sikker.fiskeridir.no/aquareg/web/sites/12081,"H-SO-0010, H-J-0007, H-KM-0014",COMMERCIAL,Matfisk,208840,12081 STRAUMNESET,"Matfisk laks, ørret, regnbueørret",,6.140132999999992,60.221333000000016
12084,ÆNES,KLARERT,"mars 19, 1998",PERMANENT,0,STK,LAND,FERSKVANN/SALTVANN,VESTLAND,4617,KVINNHERAD,60.089167,6.11,"Laks, Regnbueørret, Ørret",ÆNES INKUBATOR AS,https://sikker.fiskeridir.no/aquareg/web/sites/12084,H-K-0066,COMMERCIAL,Settefisk,208841,12084 ÆNES,"Settefisk laks, ørret, regnbueørret",,6.110000000000014,60.089166999999975
12086,ALSÅKERVIK,KLARERT,"januar 19, 1998",PERMANENT,780,TN,SJØ,SALTVANN,VESTLAND,4617,KVINNHERAD,59.759517,6.072883,Laks,MOWI ASA,https://sikker.fiskeridir.no/aquareg/web/sites/12086,"H-K-0022, H-K-0021",COMMERCIAL,Stamfisk,208842,12086 ALSÅKERVIK,"Stamfisk laks, ørret, regnbueørret",,6.07288299999999,59.75951700000002
