loknr,navn,status lokalitet,klareringsdato,klareringstype,kapasitet_lok,kapasitet enhet,plassering,vannmiljo,fylke,kommunenr,kommune,breddegrader,lengdegrader,arter,innehaver,akvakulturregister (intern),tillatelser,formål,produksjonsform,objectid,lokalitet,symbol,shape,x,y
32598,KOKELV,KLARERT,"mars 7, 2012",MIDLERTIDIG,3600,TN,SJØ,SALTVANN,TROMS OG FINNMARK,5406,HAMMERFEST,70.6381,24.5791,"Laks, Regnbueørret, Ørret",NRS FARMING AS,https://sikker.fiskeridir.no/aquareg/web/sites/32598,"F-A-0010, F-LB-0013, F-L-0024, F-A-0059, F-L-0023, F-A-0004, F-A-0044",COMMERCIAL,Matfisk,209662,32598 KOKELV,"Matfisk laks, ørret, regnbueørret",,24.579099999999983,70.63810000000001
32617,YTRE KOVEN,KLARERT,"mars 16, 2012",PERMANENT,5670,TN,SJØ,SALTVANN,TROMS OG FINNMARK,5403,ALTA,70.1421,22.89265,"Laks, Regnbueørret, Ørret",CERMAQ NORWAY AS,https://sikker.fiskeridir.no/aquareg/web/sites/32617,"F-A-0041, F-A-0055, F-KD-0027, F-KD-0031, F-A-0042, F-A-0034",COMMERCIAL,Matfisk,209663,32617 YTRE KOVEN,"Matfisk laks, ørret, regnbueørret",,22.892650000000003,70.14210000000003
32637,VEIDNES,KLARERT,"mars 19, 2012",PERMANENT,5900,TN,SJØ,SALTVANN,TROMS OG FINNMARK,5443,BÅTSFJORD,70.539917,30.136583,"Laks, Regnbueørret, Ørret","SALMAR FARMING AS, SKRETTING AS",https://sikker.fiskeridir.no/aquareg/web/sites/32637,"F-N-0003, T-H-0015, F-N-0004, F-N-0002, F-BD-0012, F-SV-0007, T-H-0016, F-N-0005, F-N-0001, F-BD-0013","COMMERCIAL, RESEARCH",Matfisk,209664,32637 VEIDNES,"Matfisk laks, ørret, regnbueørret",,30.136582999999973,70.539917
32677,ESPNESTAREN,KLARERT,"mars 22, 2012",PERMANENT,4680,TN,SJØ,SALTVANN,TRØNDELAG,5014,FRØYA,63.677883,8.667,"Laks, Regnbueørret, Ørret","AQUAGEN AS, GUNNAR ESPNES FISKEOPPDRETT AS, MÅSØVAL AS, MÅSØVAL FISHFARM AS, TRØNDELAG FYLKESKOMMUNE",https://sikker.fiskeridir.no/aquareg/web/sites/32677,"M-TV-0009, ST-F-0006, ST-HE-0005, ST-F-0066, TR-F-0011, ST-F-0005, ST-F-0062, ST-HE-0019, TR-F-0010, ST-HE-0006, ST-F-0014","COMMERCIAL, EDUCATION","Matfisk, Stamfisk",209665,32677 ESPNESTAREN,"Matfisk laks, ørret, regnbueørret",,8.666999999999973,63.67788300000001
32697,STEILO,KLARERT,"april 10, 2012",PERMANENT,3900,TN,SJØ,SALTVANN,NORDLAND,1866,HADSEL,68.51185,14.951633,"Laks, Regnbueørret, Ørret","AKVAKULTUR I VESTERÅLEN AS, NORDLAKS OPPDRETT AS, NORDLAND FYLKESKOMMUNE",https://sikker.fiskeridir.no/aquareg/web/sites/32697,"N-V-0058, N-H-0015, N-SO-0026, N-H-0032, N-V-0005, N-V-0001, N-VR-0001","COMMERCIAL, EDUCATION, EXHIBITION",Matfisk,209666,32697 STEILO,"Matfisk laks, ørret, regnbueørret",,14.951633000000015,68.51184999999998
32717,TRANØYA N,KLARERT,"april 13, 2012",PERMANENT,1560,TN,SJØ,SALTVANN,TRØNDELAG,5057,ØRLAND,63.87185,9.76985,Laks,MOWI ASA,https://sikker.fiskeridir.no/aquareg/web/sites/32717,"ST-B-0015, ST-B-0014, ST-B-0008",COMMERCIAL,Stamfisk,209667,32717 TRANØYA N,"Stamfisk laks, ørret, regnbueørret",,9.76985000000002,63.871849999999995
32757,HORGEFJORDEN,KLARERT,"april 30, 2012",PERMANENT,1560,TN,SJØ,SALTVANN,VESTLAND,4625,AUSTEVOLL,60.100833,5.117067,"Laks, Regnbueørret, Ørret","AUSTEVOLL MELAKS AS, FYLKESNES FISK AS, LANGØYLAKS AS, TELAVÅG FISKEOPPDRETT AS, TROLAND LAKSEOPPDRETT AS",https://sikker.fiskeridir.no/aquareg/web/sites/32757,"H-AV-0029, H-FJ-0005, H-S-0023, H-AV-0006, H-AV-0025, H-AV-0023, H-S-0006",COMMERCIAL,Matfisk,209668,32757 HORGEFJORDEN,"Matfisk laks, ørret, regnbueørret",,5.11706700000002,60.10083300000002
32777,HUNDBERGAN,KLARERT,"mai 3, 2012",PERMANENT,1890,TN,SJØ,SALTVANN,TROMS OG FINNMARK,5421,SENJA,69.556883,17.61055,"Laks, Regnbueørret, Ørret",FLAKSTADVÅG LAKS AS,https://sikker.fiskeridir.no/aquareg/web/sites/32777,"T-BG-0003, T-TK-0019",COMMERCIAL,Matfisk,209669,32777 HUNDBERGAN,"Matfisk laks, ørret, regnbueørret",,17.61054999999999,69.55688300000003
32797,ELVEVIKA,KLARERT,"juni 18, 2012",MIDLERTIDIG,3599,TN,SJØ,SALTVANN,TROMS OG FINNMARK,5434,MÅSØY,70.9178,25.006267,"Laks, Regnbueørret, Ørret",CERMAQ NORWAY AS,https://sikker.fiskeridir.no/aquareg/web/sites/32797,"F-M-0001, F-HV-0009, F-M-0022, F-HV-0011, F-HV-0003",COMMERCIAL,Matfisk,209670,32797 ELVEVIKA,"Matfisk laks, ørret, regnbueørret",,25.00626699999998,70.9178
32817,HASVIK,KLARERT,"juni 21, 2012",PERMANENT,0,STK,LAND,FERSKVANN/SALTVANN,TROMS OG FINNMARK,5433,HASVIK,70.4815,22.156,Laks,NORDNORSK SMOLT AS,https://sikker.fiskeridir.no/aquareg/web/sites/32817,F-HV-0013,COMMERCIAL,Settefisk,209671,32817 HASVIK,"Settefisk laks, ørret, regnbueørret",,22.156000000000006,70.48149999999998
32857,TRETTHOLMOSEN,KLARERT,"juni 29, 2012",PERMANENT,2340,TN,SJØ,SALTVANN,VESTLAND,4613,BØMLO,59.831933,5.0801,"Laks, Regnbueørret, Ørret","AS BOLAKS, BREMNES SEASHORE AS",https://sikker.fiskeridir.no/aquareg/web/sites/32857,"H-B-0002, H-B-0005, H-B-0036, H-FS-0037, H-B-0012, H-B-0022",COMMERCIAL,Matfisk,209672,32857 TRETTHOLMOSEN,"Matfisk laks, ørret, regnbueørret",,5.080100000000016,59.83193299999999
32877,SKORPO,KLARERT,"juli 3, 2012",PERMANENT,3120,TN,SJØ,SALTVANN,VESTLAND,4624,BJØRNAFJORDEN,60.173317,5.293683,"Laks, Regnbueørret, Ørret","LERØY VEST AS, SJØTROLL HAVBRUK AS",https://sikker.fiskeridir.no/aquareg/web/sites/32877,"H-O-0010, H-O-0002, H-S-0002, H-S-0004, H-AV-0024, H-S-0014, H-AV-0020, H-S-0003",COMMERCIAL,Matfisk,209673,32877 SKORPO,"Matfisk laks, ørret, regnbueørret",,5.293682999999987,60.173317
32897,BREIVIKA S,KLARERT,"juli 3, 2012",PERMANENT,3900,TN,SJØ,SALTVANN,NORDLAND,1827,DØNNA,66.1581,12.682017,"Laks, Regnbueørret, Ørret",MOWI ASA,https://sikker.fiskeridir.no/aquareg/web/sites/32897,"N-DA-0004, N-HR-0004, N-DA-0005, N-HR-0001, N-DA-0024",COMMERCIAL,Matfisk,209674,32897 BREIVIKA S,"Matfisk laks, ørret, regnbueørret",,12.682016999999973,66.15809999999999
32917,GREGUSVIKA,KLARERT,"juli 5, 2012",PERMANENT,5400,TN,SJØ,SALTVANN,TROMS OG FINNMARK,5413,IBESTAD,68.81875,17.34635,"Laks, Regnbueørret, Ørret","GRATANGLAKS AS, KLEIVA FISKEFARM AS",https://sikker.fiskeridir.no/aquareg/web/sites/32917,"T-I-0018, T-G-0007, T-T-0005, T-I-0001, T-I-0005, T-G-0004, T-BG-0006",COMMERCIAL,Matfisk,209675,32917 GREGUSVIKA,"Matfisk laks, ørret, regnbueørret",,17.346349999999973,68.81875000000002
32938,ÅKRESTRØMMEN,KLARERT,"juli 6, 2012",PERMANENT,2250,TN,LAND,FERSKVANN,INNLANDET,3424,RENDALEN,61.698083,11.22655,Røye,RENDALSFISK AS,https://sikker.fiskeridir.no/aquareg/web/sites/32938,"HE-R-0503, HE-R-0004, HE-R-0008, HE-R-0007, HE-R-0003, HE-R-0009, HE-R-0005, HE-R-0006",COMMERCIAL,"Matfisk, Settefisk",209676,32938 ÅKRESTRØMMEN,Andre,,11.226549999999975,61.698083
32977,MÅREN,KLARERT,"august 22, 2012",PERMANENT,3120,TN,SJØ,SALTVANN,VESTLAND,4638,HØYANGER,61.152667,6.1167,"Laks, Regnbueørret, Ørret","OSLAND HAVBRUK AS, OSLAND STAMFISK AS, TROLAND LAKSEOPPDRETT AS",https://sikker.fiskeridir.no/aquareg/web/sites/32977,"SF-HØ-0009, SF-HØ-0001, SF-HØ-0024, SF-HØ-0020, R-V-0023, H-AV-0093, R-V-0027, SF-HØ-0018",COMMERCIAL,"Matfisk, Stamfisk",209677,32977 MÅREN,"Matfisk laks, ørret, regnbueørret",,6.11669999999998,61.15266700000001
32997,RAVEN,KLARERT,"september 5, 2012",MIDLERTIDIG,4680,TN,SJØ,SALTVANN,NORDLAND,1865,VÅGAN,68.286683,15.122683,"Laks, Regnbueørret, Ørret",NORDLAKS OPPDRETT AS,https://sikker.fiskeridir.no/aquareg/web/sites/32997,"N-V-0033, N-H-0015, N-V-0058, N-H-0014, N-V-0005, N-H-0004",COMMERCIAL,Matfisk,209678,32997 RAVEN,"Matfisk laks, ørret, regnbueørret",,15.122682999999995,68.28668299999998
33017,SETEVIKA N,KLARERT,"september 13, 2012",PERMANENT,3120,TN,SJØ,SALTVANN,MØRE OG ROMSDAL,1506,MOLDE,62.73835,6.937667,"Laks, Regnbueørret, Ørret","MØRE OG ROMSDAL FYLKESKOMMUNE, NORGES TEKNISK-NATURVITENSKAPELIGE UNIVERSITET NTNU, SALMAR FARMING AS",https://sikker.fiskeridir.no/aquareg/web/sites/33017,"M-S-0023, M-H-0006, M-RA-0016, M-AV-0028, M-VS-0016, M-VS-0018, M-S-0002, M-VS-0017, M-MD-0019","COMMERCIAL, EDUCATION, RESEARCH",Matfisk,209679,33017 SETEVIKA N,"Matfisk laks, ørret, regnbueørret",,6.937666999999976,62.738350000000025
33037,RÆSTAD II,KLARERT,"september 18, 2012",PERMANENT,50,TN,LAND,SALTVANN,MØRE OG ROMSDAL,1506,MOLDE,62.740183,6.840517,Rognkjeks (felles),NORSK OPPDRETTSSERVICE AS,https://sikker.fiskeridir.no/aquareg/web/sites/33037,"M-MD-0026, M-MD-0025",COMMERCIAL,"Settefisk, Stamfisk",209680,33037 RÆSTAD II,Andre,,6.840516999999977,62.740183
33077,ELVENESET,KLARERT,"oktober 3, 2012",PERMANENT,3120,TN,SJØ,SALTVANN,VESTLAND,4637,HYLLESTAD,61.206,5.131733,"Laks, Regnbueørret, Ørret",FIRDA SJØFARMER AS,https://sikker.fiskeridir.no/aquareg/web/sites/33077,"SF-G-0010, SF-G-0002, SF-G-0006, SF-G-0011, SF-G-0022, SF-G-0038, SF-A-0030, SF-N-0001, SF-A-0031, SF-G-0005, SF-H-0001, SF-H-0003, SF-G-0009",COMMERCIAL,Matfisk,209681,33077 ELVENESET,"Matfisk laks, ørret, regnbueørret",,5.131732999999997,61.20600000000002
33097,SKJERVØY V,KLARERT,"oktober 10, 2012",MIDLERTIDIG,3600,TN,SJØ,SALTVANN,TROMS OG FINNMARK,5427,SKJERVØY,70.04375,20.94965,"Laks, Regnbueørret, Ørret",ARNØY LAKS AS,https://sikker.fiskeridir.no/aquareg/web/sites/33097,"T-S-0007, T-S-0003, T-S-0017, T-S-0011",COMMERCIAL,Matfisk,209682,33097 SKJERVØY V,"Matfisk laks, ørret, regnbueørret",,20.94965000000002,70.04374999999999
33117,DJUPVIK,KLARERT,"oktober 9, 2012",PERMANENT,1280,TN,SJØ,SALTVANN,NORDLAND,1870,SORTLAND,68.60365,15.34815,"Laks, Regnbueørret, Ørret","AKVAKULTUR I VESTERÅLEN AS, NORDLAND FYLKESKOMMUNE",https://sikker.fiskeridir.no/aquareg/web/sites/33117,"N-SO-0026, N-H-0032","EDUCATION, EXHIBITION",Matfisk,209683,33117 DJUPVIK,Særtillatelser,,15.348149999999976,68.60365000000002
33137,BRATTBERG,KLARERT,"oktober 16, 2012",MIDLERTIDIG,900,TN,SJØ,SALTVANN,TROMS OG FINNMARK,5414,GRATANGEN,68.713517,17.429533,"Laks, Regnbueørret, Ørret",ASTAFJORD SLAKTERI AS,https://sikker.fiskeridir.no/aquareg/web/sites/33137,"T-G-0011, T-G-0014",SLAUGHTER PEN,Matfisk,209684,33137 BRATTBERG,Slaktemerd,,17.429532999999992,68.71351700000002
33157,SKOGSHOLMEN,KLARERT,"oktober 11, 2012",PERMANENT,0,TN,SJØ,SALTVANN,NORDLAND,1815,VEGA,65.831417,12.070533,"Laks, Regnbueørret, Ørret","NOVA SEA AS, VEGA SJØFARM AS, VEGALAKS AS",https://sikker.fiskeridir.no/aquareg/web/sites/33157,"N-HR-0013, N-VA-0017, N-SA-0006, N-ME-0008, N-SA-0007, N-VA-0015",COMMERCIAL,Matfisk,209685,33157 SKOGSHOLMEN,"Matfisk laks, ørret, regnbueørret",,12.070533000000012,65.83141699999999
33158,KJÆRSUNDET V,KLARERT,"oktober 19, 2012",PERMANENT,5000000,STK,LAND,SALTVANN,TRØNDELAG,5049,FLATANGER,64.505967,10.844533,Rognkjeks (felles),NAMDAL RENSEFISK AS,https://sikker.fiskeridir.no/aquareg/web/sites/33158,"NT-F-0032, NT-F-0031",COMMERCIAL,"Settefisk, Stamfisk",209686,33158 KJÆRSUNDET V,Andre,,10.844533000000013,64.505967
33177,KRABBHOLMEN II,KLARERT,"november 26, 2012",PERMANENT,3120,TN,SJØ,SALTVANN,TRØNDELAG,5058,ÅFJORD,63.94,9.886633,"Laks, Regnbueørret, Ørret","AS KNUTSHAUGFISK, SALMAR FARMING AS",https://sikker.fiskeridir.no/aquareg/web/sites/33177,"ST-R-0007, ST-H-0055, ST-H-0007, ST-R-0024, ST-H-0009, ST-R-0003",COMMERCIAL,Matfisk,209687,33177 KRABBHOLMEN II,"Matfisk laks, ørret, regnbueørret",,9.886633000000018,63.94
33197,JERNELVA,KLARERT,"desember 10, 2012",PERMANENT,2700,TN,SJØ,SALTVANN,TROMS OG FINNMARK,5406,HAMMERFEST,70.449583,23.63825,"Laks, Regnbueørret, Ørret",CERMAQ NORWAY AS,https://sikker.fiskeridir.no/aquareg/web/sites/33197,"F-KD-0032, F-KD-0029, F-KD-0031",COMMERCIAL,Matfisk,209688,33197 JERNELVA,"Matfisk laks, ørret, regnbueørret",,23.638250000000028,70.44958300000002
33217,FORSAN,KLARERT,"desember 19, 2012",PERMANENT,0,STK,LAND,FERSKVANN,NORDLAND,1848,STEIGEN,67.950917,15.638667,"Laks, Regnbueørret, Ørret",CERMAQ NORWAY AS,https://sikker.fiskeridir.no/aquareg/web/sites/33217,N-SG-0036,COMMERCIAL,Settefisk,209689,33217 FORSAN,"Settefisk laks, ørret, regnbueørret",,15.638666999999998,67.950917
33218,HOSENØYAN,KLARERT,"desember 19, 2012",PERMANENT,6240,TN,SJØ,SALTVANN,TRØNDELAG,5058,ÅFJORD,64.085183,9.884683,"Laks, Regnbueørret, Ørret","SALMAR FARMING AS, SINTEF OCEAN AS",https://sikker.fiskeridir.no/aquareg/web/sites/33218,"ST-AA-0033, ST-AA-0029, ST-R-0023, ST-AA-0007, ST-F-0018, ST-F-0070, ST-AA-0028, ST-F-0019, ST-AA-0027, ST-AA-0017, ST-F-0069, ST-Ø-0001, ST-AA-0034","COMMERCIAL, RESEARCH",Matfisk,209690,33218 HOSENØYAN,"Matfisk laks, ørret, regnbueørret",,9.884682999999995,64.08518299999997
33237,BREIVOLL,KLARERT,"desember 20, 2012",MIDLERTIDIG,0,TN,SJØ,SALTVANN,TROMS OG FINNMARK,5413,IBESTAD,68.758417,17.152517,Laks,BREIVOLL MARINE PRODUKTER AS,https://sikker.fiskeridir.no/aquareg/web/sites/33237,T-I-0020,SLAUGHTER PEN,Matfisk,209691,33237 BREIVOLL,Slaktemerd,,17.15251699999999,68.75841700000001
33277,LOVUND SMOLT,KLARERT,"januar 11, 2013",PERMANENT,750,TN,LAND,FERSKVANN,NORDLAND,1834,LURØY,66.368233,12.3797,Laks,VIGNER OLAISEN AS,https://sikker.fiskeridir.no/aquareg/web/sites/33277,N-L-0056,COMMERCIAL,Settefisk,209692,33277 LOVUND SMOLT,"Settefisk laks, ørret, regnbueørret",,12.379700000000014,66.36823299999998
33297,NYE SKORPA,KLARERT,"januar 15, 2013",PERMANENT,2560,TN,SJØ,SALTVANN,NORDLAND,1827,DØNNA,66.030933,12.481483,"Laks, Regnbueørret, Ørret","SALMO PHARMA AS, SELØY SJØFARM AS",https://sikker.fiskeridir.no/aquareg/web/sites/33297,"N-HR-0019, N-HR-0076, N-HR-0072, N-HR-0011, N-HR-0071","COMMERCIAL, RESEARCH",Matfisk,209693,33297 NYE SKORPA,"Matfisk laks, ørret, regnbueørret",,12.481483000000026,66.030933
33337,LYNGNES,KLARERT,"januar 22, 2013",PERMANENT,3120,TN,SJØ,SALTVANN,VESTLAND,4624,BJØRNAFJORDEN,60.119683,5.719817,"Laks, Regnbueørret, Ørret",AS BOLAKS,https://sikker.fiskeridir.no/aquareg/web/sites/33337,"H-FS-0004, H-FS-0017, H-FS-0014, H-FS-0010, H-FS-0037, H-FS-0001, H-O-0012, H-FS-0006, H-R-0003, H-O-0013",COMMERCIAL,Matfisk,209694,33337 LYNGNES,"Matfisk laks, ørret, regnbueørret",,5.719816999999978,60.11968300000001
33357,GULLKLAKKEN,KLARERT,"januar 30, 2013",PERMANENT,500,TN,SJØ,SALTVANN,MØRE OG ROMSDAL,1573,SMØLA,63.479217,7.999867,"Laks, Regnbueørret, Ørret",NEKTON HAVBRUK AS,https://sikker.fiskeridir.no/aquareg/web/sites/33357,M-SM-0037,COMMERCIAL,Matfisk,209695,33357 GULLKLAKKEN,"Matfisk laks, ørret, regnbueørret",,7.999866999999995,63.479217000000006
33377,FINNANGERØYA,KLARERT,"januar 30, 2013",PERMANENT,780,TN,SJØ,SALTVANN,TRØNDELAG,5007,NAMSOS,64.621767,11.179,Torsk,NAMDAL SETTEFISK AS,https://sikker.fiskeridir.no/aquareg/web/sites/33377,NT-N-0021,COMMERCIAL,Matfisk,209696,33377 FINNANGERØYA,Andre,,11.178999999999974,64.62176699999998
33417,PERSFLUA,KLARERT,"februar 19, 2013",PERMANENT,6240,TN,SJØ,SALTVANN,TRØNDELAG,5057,ØRLAND,63.91345,9.826433,"Laks, Regnbueørret, Ørret",MOWI ASA,https://sikker.fiskeridir.no/aquareg/web/sites/33417,"ST-B-0011, ST-F-0021, ST-B-0002, ST-F-0032, ST-F-0024, ST-B-0003, ST-F-0029, ST-B-0001",COMMERCIAL,Matfisk,209697,33417 PERSFLUA,"Matfisk laks, ørret, regnbueørret",,9.826433000000009,63.91345000000001
33437,ÅDNAHOLMEN,KLARERT,"mars 12, 2013",PERMANENT,3120,TN,SJØ,SALTVANN,ROGALAND,1103,STAVANGER,59.278067,5.777617,"Laks, Regnbueørret, Ørret",GRIEG SEAFOOD ROGALAND AS,https://sikker.fiskeridir.no/aquareg/web/sites/33437,"R-SS-0010, R-R-0002, R-F-0002, R-SS-0005",COMMERCIAL,Matfisk,209698,33437 ÅDNAHOLMEN,"Matfisk laks, ørret, regnbueørret",,5.777617000000021,59.27806700000002
33457,ÅNDERBAKK,KLARERT,"mars 25, 2013",PERMANENT,3900,TN,SJØ,SALTVANN,NORDLAND,1848,STEIGEN,67.754667,15.70465,"Laks, Regnbueørret, Ørret",CERMAQ NORWAY AS,https://sikker.fiskeridir.no/aquareg/web/sites/33457,"N-SG-0027, N-HM-0002, N-SG-0016, N-SG-0028, N-SG-0007",COMMERCIAL,Matfisk,209699,33457 ÅNDERBAKK,"Matfisk laks, ørret, regnbueørret",,15.704650000000015,67.75466699999998
33477,REINSNESØYA,KLARERT,"mai 16, 2013",PERMANENT,3120,TN,SJØ,SALTVANN,NORDLAND,1870,SORTLAND,68.772833,15.446583,"Laks, Regnbueørret, Ørret","EIDSFJORD SJØFARM AS, NORDLAND FYLKESKOMMUNE",https://sikker.fiskeridir.no/aquareg/web/sites/33477,"N-VV-0007, N-SO-0027, N-H-0020, N-Ø-0006, N-H-0032, N-SO-0029, N-SO-0010","COMMERCIAL, EDUCATION",Matfisk,209700,33477 REINSNESØYA,"Matfisk laks, ørret, regnbueørret",,15.446582999999976,68.77283299999999
33517,PETTERNES,KLARERT,"mai 30, 2013",MIDLERTIDIG,3600,TN,SJØ,SALTVANN,TROMS OG FINNMARK,5434,MÅSØY,70.8172,24.590567,"Laks, Regnbueørret, Ørret",NRS FARMING AS,https://sikker.fiskeridir.no/aquareg/web/sites/33517,"F-A-0010, F-A-0058, F-A-0043, F-L-0024, F-A-0059, F-L-0023, F-A-0044",COMMERCIAL,Matfisk,209701,33517 PETTERNES,"Matfisk laks, ørret, regnbueørret",,24.59056700000002,70.81720000000001
33537,BUHOLMEN,KLARERT,"juni 6, 2013",MIDLERTIDIG,3120,TN,SJØ,SALTVANN,TRØNDELAG,5058,ÅFJORD,64.1569,10.008917,"Laks, Regnbueørret, Ørret","SALMAR FARMING AS, SINTEF OCEAN AS",https://sikker.fiskeridir.no/aquareg/web/sites/33537,"ST-AA-0033, ST-R-0023, ST-AA-0007, ST-F-0018, ST-F-0070, ST-F-0019, ST-AA-0017, ST-F-0069, ST-Ø-0001, ST-AA-0034","COMMERCIAL, RESEARCH",Matfisk,209702,33537 BUHOLMEN,"Matfisk laks, ørret, regnbueørret",,10.008916999999997,64.15690000000001
33557,LANGSKJÆRA II,KLARERT,"juli 1, 2013",PERMANENT,4680,TN,SJØ,SALTVANN,TRØNDELAG,5014,FRØYA,63.821817,8.743433,"Laks, Regnbueørret, Ørret",LERØY MIDT AS,https://sikker.fiskeridir.no/aquareg/web/sites/33557,"ST-F-0071, ST-H-0015, ST-H-0012, ST-H-0011, ST-H-0045, ST-H-0010",COMMERCIAL,"Matfisk, Stamfisk",209703,33557 LANGSKJÆRA II,"Matfisk laks, ørret, regnbueørret",,8.743432999999982,63.82181700000001
33577,KJEHOLMEN II,KLARERT,"juli 4, 2013",PERMANENT,2340,TN,SJØ,SALTVANN,AGDER,4206,FARSUND,58.060083,6.885683,"Laks, Regnbueørret, Ørret","HELLESUND FISKEOPPDRETT AS, KORSHAVN HAVBRUK AS, SØRVEST LAKS AS",https://sikker.fiskeridir.no/aquareg/web/sites/33577,"AA-L-0001, VA-F-0016, AA-L-0004",COMMERCIAL,Matfisk,209704,33577 KJEHOLMEN II,"Matfisk laks, ørret, regnbueørret",,6.885682999999972,58.06008300000002
33597,GRYTØYRAHOLMEN,KLARERT,"august 2, 2013",PERMANENT,2340,TN,SJØ,SALTVANN,VESTLAND,4646,FJALER,61.292783,5.014117,"Laks, Regnbueørret, Ørret",SANDNES FISKEOPPDRETT AS,https://sikker.fiskeridir.no/aquareg/web/sites/33597,"SF-FL-0014, SF-FL-0016, SF-FL-0008",COMMERCIAL,Matfisk,209705,33597 GRYTØYRAHOLMEN,"Matfisk laks, ørret, regnbueørret",,5.014116999999999,61.292782999999986
33617,GJERDE,KLARERT,"september 9, 2013",PERMANENT,4680,TN,SJØ,SALTVANN,MØRE OG ROMSDAL,1576,AURE,63.299667,8.418333,"Laks, Regnbueørret, Ørret",SALMAR FARMING AS,https://sikker.fiskeridir.no/aquareg/web/sites/33617,"M-SM-0035, ST-AA-0029, M-SM-0036, ST-AA-0028, ST-AA-0027, M-SM-0034, M-AV-0001",COMMERCIAL,Matfisk,209706,33617 GJERDE,"Matfisk laks, ørret, regnbueørret",,8.418333000000018,63.299667
33657,MOVIKODDEN N,KLARERT,"oktober 2, 2013",PERMANENT,3120,TN,SJØ,SALTVANN,NORDLAND,1834,LURØY,66.532867,12.888433,"Laks, Regnbueørret, Ørret","KVARØY FISKEOPPDRETT A/S, LOFOTEN AQUA AS, ORGANIC SEAFARM AS, SALMOBREED SALTEN AS",https://sikker.fiskeridir.no/aquareg/web/sites/33657,"N-L-0006, N-SF-0021, N-L-0069, N-L-0003, N-L-0070, N-L-0005, N-VV-0060, N-L-0051",COMMERCIAL,"Matfisk, Stamfisk",209707,33657 MOVIKODDEN N,"Matfisk laks, ørret, regnbueørret",,12.88843300000002,66.53286700000001
33677,TORVUND,KLARERT,"oktober 10, 2013",PERMANENT,3120,TN,SJØ,SALTVANN,VESTLAND,4638,HØYANGER,61.144667,5.656367,"Laks, Regnbueørret, Ørret","OSLAND HAVBRUK AS, TROLAND LAKSEOPPDRETT AS",https://sikker.fiskeridir.no/aquareg/web/sites/33677,"SF-HØ-0009, H-AV-0093, SF-HØ-0018, SF-HØ-0001",COMMERCIAL,Matfisk,209708,33677 TORVUND,"Matfisk laks, ørret, regnbueørret",,5.656366999999989,61.14466700000003
33697,FORRAHAMMAREN,KLARERT,"november 4, 2012",MIDLERTIDIG,2840,TN,SJØ,SALTVANN,TRØNDELAG,5055,HEIM,63.350433,9.23325,"Laks, Regnbueørret, Ørret",AQUAGEN AS,https://sikker.fiskeridir.no/aquareg/web/sites/33697,"ST-HE-0016, ST-HE-0019, ST-HE-0020, ST-HE-0005","COMMERCIAL, RESEARCH","Matfisk, Stamfisk",209709,33697 FORRAHAMMAREN,Særtillatelser,,9.233249999999998,63.35043300000001
33717,ÆSVIKA I,KLARERT,"november 8, 2013",PERMANENT,500,TN,LAND,SALTVANN,NORDLAND,1837,MELØY,66.741267,13.5144,Flekksteinbit,AMINOR AS,https://sikker.fiskeridir.no/aquareg/web/sites/33717,N-ME-0060,COMMERCIAL,Matfisk,209710,33717 ÆSVIKA I,Andre,,13.514400000000023,66.741267
33737,OLAUSSKJÆRET,KLARERT,"november 11, 2013",PERMANENT,3120,TN,SJØ,SALTVANN,TRØNDELAG,5014,FRØYA,63.7917,8.504717,"Laks, Regnbueørret, Ørret","REFSNES LAKS AS, SALMAR FARMING AS",https://sikker.fiskeridir.no/aquareg/web/sites/33737,"ST-AA-0014, ST-F-0027, ST-F-0010, ST-F-0017, ST-F-0061, ST-AA-0026, ST-F-0026, ST-AA-0005",COMMERCIAL,Matfisk,209711,33737 OLAUSSKJÆRET,"Matfisk laks, ørret, regnbueørret",,8.504717000000028,63.79169999999999
33757,HÅBRANDEN,KLARERT,"november 25, 2013",PERMANENT,3120,TN,SJØ,SALTVANN,TRØNDELAG,5014,FRØYA,63.942,9.133483,"Laks, Regnbueørret, Ørret",OCEAN FARMING AS,https://sikker.fiskeridir.no/aquareg/web/sites/33757,"TR-F-0014, TR-F-0019, TR-F-0017, TR-F-0013, TR-F-0012, TR-F-0015, TR-F-0016, TR-F-0018",COMMERCIAL,Matfisk,209712,33757 HÅBRANDEN,"Matfisk laks, ørret, regnbueørret",,9.133483000000012,63.94200000000001
33777,LAUSKLUBBEN,KLARERT,"november 27, 2013",PERMANENT,3600,TN,SJØ,SALTVANN,TROMS OG FINNMARK,5442,UNJÁRGA - NESSEBY,70.02435,29.292183,"Laks, Regnbueørret, Ørret",LERØY AURORA AS,https://sikker.fiskeridir.no/aquareg/web/sites/33777,"F-SV-0008, F-N-0006, F-SV-0011, F-SV-0009, F-SV-0010",COMMERCIAL,Matfisk,209713,33777 LAUSKLUBBEN,"Matfisk laks, ørret, regnbueørret",,29.292183000000023,70.02435000000003
33797,HIDLEKJERRINGA,KLARERT,"desember 6, 2013",MIDLERTIDIG,3600,TN,SJØ,SALTVANN,ROGALAND,1130,STRAND,59.0676,5.839367,"Laks, Regnbueørret, Ørret",BREMNES SEASHORE AS,https://sikker.fiskeridir.no/aquareg/web/sites/33797,"R-SS-0011, R-SS-0018, R-SS-0008, R-FD-0016",COMMERCIAL,Matfisk,209714,33797 HIDLEKJERRINGA,"Matfisk laks, ørret, regnbueørret",,5.8393669999999815,59.06760000000003
33817,ORSTRANDA,KLARERT,"januar 7, 2014",PERMANENT,45,DA,SJØ,SALTVANN,MØRE OG ROMSDAL,1505,KRISTIANSUND,63.0345,7.83515,"Butare, Fjærehinne uspes, Sukkertare",ALGEA AS,https://sikker.fiskeridir.no/aquareg/web/sites/33817,M-K-0901,COMMERCIAL,Alger til konsum,209715,33817 ORSTRANDA,Alger,,7.835149999999999,63.03449999999998
33857,STRAUMEN,KLARERT,"januar 8, 2014",PERMANENT,60,DA,SJØ,BRAKKVANN,TRØNDELAG,5054,Indre Fosen,63.580633,9.948833,Blåskjell,SNADDER OG SNASKUM AS,https://sikker.fiskeridir.no/aquareg/web/sites/33857,ST-RS-0801,COMMERCIAL,Havbeite,209716,33857 STRAUMEN,"Bløtdyr, krepsdyr, pigghuder",,9.94883299999998,63.58063299999998
33877,BJORNEREMSBUKTA,KLARERT,"januar 10, 2014",PERMANENT,1,TN,LAND,SALTVANN,MØRE OG ROMSDAL,1506,MOLDE,62.692067,6.639833,"Hummer, Sjøkreps, Taskekrabbe",SILVER SEAFOOD AS,https://sikker.fiskeridir.no/aquareg/web/sites/33877,"M-MD-0335, M-MD-0337, M-MD-0336",COMMERCIAL,Akvakulturdyr til konsum,209717,33877 BJORNEREMSBUKTA,"Bløtdyr, krepsdyr, pigghuder",,6.63983300000001,62.69206700000001
33897,KVERHELLA,KLARERT,"januar 10, 2014",PERMANENT,70,M2,LAND,SALTVANN,VESTLAND,4636,SOLUND,60.994317,4.707383,"Butare, Fingertare, Sukkertare, Søl",HORTIMARE AS,https://sikker.fiskeridir.no/aquareg/web/sites/33897,"SF-SU-0906, SF-SU-0905, SF-SU-0908, SF-SU-0907",COMMERCIAL,Alger tidlig fase,209718,33897 KVERHELLA,Alger,,4.707382999999993,60.994317000000024
33917,ØREN,KLARERT,"januar 21, 2014",PERMANENT,650,TN,LAND,FERSKVANN/SALTVANN,NORDLAND,1837,MELØY,66.758167,13.7763,"Russisk stør, Sibirsk stør, Sterlet stør",POLARFISK- AS,https://sikker.fiskeridir.no/aquareg/web/sites/33917,N-ME-0061,COMMERCIAL,Matfisk,209719,33917 ØREN,Andre,,13.776299999999992,66.75816700000001
33937,NØRHOLMEN,KLARERT,"mai 19, 2015",PERMANENT,3120,TN,SJØ,SALTVANN,MØRE OG ROMSDAL,1573,SMØLA,63.338917,8.2718,"Laks, Regnbueørret, Ørret",MOWI ASA,https://sikker.fiskeridir.no/aquareg/web/sites/33937,"M-SM-0010, M-AV-0018, M-AV-0004, M-SM-0009, M-SM-0017, M-AV-0006, M-AV-0007, M-SM-0013",COMMERCIAL,Matfisk,209720,33937 NØRHOLMEN,"Matfisk laks, ørret, regnbueørret",,8.271799999999985,63.33891699999998
33957,HOFSØYA,KLARERT,"januar 24, 2014",PERMANENT,7020,TN,SJØ,SALTVANN,TRØNDELAG,5014,FRØYA,63.7224,8.9145,"Laks, Regnbueørret, Ørret",LERØY MIDT AS,https://sikker.fiskeridir.no/aquareg/web/sites/33957,"ST-F-0071, ST-H-0002, ST-SI-0015, ST-F-0023, ST-F-0030, ST-SI-0016, ST-H-0003",COMMERCIAL,"Matfisk, Stamfisk",209721,33957 HOFSØYA,"Matfisk laks, ørret, regnbueørret",,8.914499999999975,63.72239999999999
33977,FASLE,KLARERT,"februar 4, 2014",PERMANENT,300000,STK,LAND,FERSKVANN,INNLANDET,3451,NORD-AURDAL,60.960417,9.302217,Regnbueørret,HAADEM  HENRIK,https://sikker.fiskeridir.no/aquareg/web/sites/33977,OP-NA-0006,COMMERCIAL,Settefisk,209722,33977 FASLE,"Settefisk laks, ørret, regnbueørret",,9.302216999999985,60.96041700000001
33997,NÆRINGSBUKTA,KLARERT,"februar 5, 2014",MIDLERTIDIG,3600,TN,SJØ,SALTVANN,TROMS OG FINNMARK,5433,HASVIK,70.658917,22.642417,"Laks, Regnbueørret, Ørret",NRS FARMING AS,https://sikker.fiskeridir.no/aquareg/web/sites/33997,"F-A-0056, F-A-0004, F-A-0057, F-A-0045",COMMERCIAL,Matfisk,209723,33997 NÆRINGSBUKTA,"Matfisk laks, ørret, regnbueørret",,22.642417000000023,70.65891699999997
33998,KLUBBEN,KLARERT,"februar 5, 2014",MIDLERTIDIG,3600,TN,SJØ,SALTVANN,TROMS OG FINNMARK,5433,HASVIK,70.663967,22.6224,"Laks, Regnbueørret, Ørret",NRS FARMING AS,https://sikker.fiskeridir.no/aquareg/web/sites/33998,"F-A-0056, F-A-0045, F-A-0057, F-A-0004, TF-H-0002",COMMERCIAL,Matfisk,209724,33998 KLUBBEN,"Matfisk laks, ørret, regnbueørret",,22.622400000000027,70.66396700000001
34018,DOLMA N,KLARERT,"februar 12, 2014",PERMANENT,3120,TN,SJØ,SALTVANN,TRØNDELAG,5060,NÆRØYSUND,65.025333,11.676017,"Laks, Regnbueørret, Ørret","BJØRØYA AS, MIDT-NORSK HAVBRUK AS",https://sikker.fiskeridir.no/aquareg/web/sites/34018,"NT-V-0033, NT-F-0028, NT-V-0010, NT-F-0029, NT-NR-0051",COMMERCIAL,Matfisk,209725,34018 DOLMA N,"Matfisk laks, ørret, regnbueørret",,11.676017000000002,65.02533299999999
