loknr,navn,status lokalitet,klareringsdato,klareringstype,kapasitet_lok,kapasitet enhet,plassering,vannmiljo,fylke,kommunenr,kommune,breddegrader,lengdegrader,arter,innehaver,akvakulturregister (intern),tillatelser,formål,produksjonsform,objectid,lokalitet,symbol,shape,x,y
10029,TUHOLMANE Ø,KLARERT,"juni 19, 1998",PERMANENT,2340,TN,SJØ,SALTVANN,ROGALAND,1149,KARMØY,59.371233,5.216333,"Laks, Regnbueørret, Ørret","LINGALAKS AS, TOMBRE FJORDFARM AS, VARDE FISKEOPPDRETT AS",https://sikker.fiskeridir.no/aquareg/web/sites/10029,"H-B-0003, R-K-0005, R-K-0004, H-B-0008, R-K-0007",COMMERCIAL,Matfisk,208404,10029 TUHOLMANE Ø,"Matfisk laks, ørret, regnbueørret",,5.21633300000002,59.37123300000002
10037,GILJEHOLMEN,KLARERT,"november 22, 1999",PERMANENT,209,TN,SJØ,SALTVANN,VESTLAND,4626,ØYGARDEN,60.339883,4.96755,Kamskjell,SEKKINGSTAD PRESERVING AS,https://sikker.fiskeridir.no/aquareg/web/sites/10037,H-F-0318,COMMERCIAL,Akvakulturdyr til konsum,208405,10037 GILJEHOLMEN,"Bløtdyr, krepsdyr, pigghuder",,4.967550000000017,60.339882999999986
10040,SØRVIK,KLARERT,"januar 19, 1995",PERMANENT,65,TN,SJØ,SALTVANN,VESTLAND,4615,FITJAR,59.88065,5.102933,Torsk,OSKAR SØRVIK JR,https://sikker.fiskeridir.no/aquareg/web/sites/10040,H-FJ-0017,CENSUS,Matfisk,208406,10040 SØRVIK,Andre,,5.102933000000007,59.88065
10041,KVIKSHOLMEN,KLARERT,"desember 2, 1997",PERMANENT,2340,TN,SJØ,SALTVANN,VESTLAND,4625,AUSTEVOLL,60.054317,5.090733,"Laks, Regnbueørret, Ørret",LANGØYLAKS AS,https://sikker.fiskeridir.no/aquareg/web/sites/10041,"H-AV-0029, H-AV-0023",COMMERCIAL,Matfisk,208407,10041 KVIKSHOLMEN,"Matfisk laks, ørret, regnbueørret",,5.090733,60.054317000000026
10044,GODDOSEN,KLARERT,"oktober 28, 1993",PERMANENT,65,TN,SJØ,SALTVANN,VESTLAND,4613,BØMLO,59.862167,5.13615,Torsk,TORGET  KNUT ARNE,https://sikker.fiskeridir.no/aquareg/web/sites/10044,H-B-0028,CENSUS,Matfisk,208408,10044 GODDOSEN,Andre,,5.1361499999999864,59.862167
10045,EIDHOLMEN,KLARERT,"desember 2, 1997",PERMANENT,780,TN,SJØ,SALTVANN,VESTLAND,4625,AUSTEVOLL,60.088083,5.120633,"Laks, Regnbueørret, Ørret","LANGØYLAKS AS, TELAVÅG FISKEOPPDRETT AS, TROLAND LAKSEOPPDRETT AS",https://sikker.fiskeridir.no/aquareg/web/sites/10045,"H-AV-0029, H-S-0023, H-AV-0025, H-AV-0023, H-S-0006",COMMERCIAL,Matfisk,208409,10045 EIDHOLMEN,"Matfisk laks, ørret, regnbueørret",,5.120632999999998,60.08808299999998
10050,OSPØY Ø,KLARERT,"august 4, 1998",PERMANENT,1560,TN,SJØ,SALTVANN,VESTLAND,4613,BØMLO,59.866567,5.228133,"Laks, Regnbueørret, Ørret","ALLER AQUA NORWAY AS, FYLKESNES FISK AS",https://sikker.fiskeridir.no/aquareg/web/sites/10050,"H-FJ-0005, H-B-0009, H-B-0046, H-B-0021","COMMERCIAL, RESEARCH",Matfisk,208410,10050 OSPØY Ø,"Matfisk laks, ørret, regnbueørret",,5.228133000000014,59.866566999999975
10052,KLUBBEOSEN I,KLARERT,"august 10, 1992",PERMANENT,7,DA,SJØ,SALTVANN,VESTLAND,4613,BØMLO,59.831133,5.249333,Østers,AGA MUSLING EIVIND BERGTUN & SIGURD MONSVIK,https://sikker.fiskeridir.no/aquareg/web/sites/10052,H-B-0357,COMMERCIAL,Akvakulturdyr til konsum,208411,10052 KLUBBEOSEN I,"Bløtdyr, krepsdyr, pigghuder",,5.249332999999979,59.83113300000002
10054,TOBBEHOLMANE,KLARERT,"januar 1, 2002",PERMANENT,3120,TN,SJØ,SALTVANN,VESTLAND,4625,AUSTEVOLL,60.024317,5.30815,"Laks, Regnbueørret, Ørret","LERØY VEST AS, SJØTROLL HAVBRUK AS",https://sikker.fiskeridir.no/aquareg/web/sites/10054,"H-O-0010, H-O-0002, H-AV-0011, H-AV-0021, H-AV-0024, H-AV-0014, H-AV-0020, H-AV-0040",COMMERCIAL,Matfisk,208412,10054 TOBBEHOLMANE,"Matfisk laks, ørret, regnbueørret",,5.308150000000012,60.024316999999996
10060,FJON,KLARERT,"oktober 12, 1999",PERMANENT,20000000,STK,LAND,FERSKVANN,VESTLAND,4612,SVEIO,59.51161,5.445748,"Laks, Regnbueørret, Ørret",FJON BRUK AS,https://sikker.fiskeridir.no/aquareg/web/sites/10060,H-SO-0003,COMMERCIAL,Settefisk,208413,10060 FJON,"Settefisk laks, ørret, regnbueørret",,5.4457479999999805,59.51161000000002
10062,PARISVATNET,KLARERT,"oktober 5, 1995",PERMANENT,500000,STK,LAND,SALTVANN,VESTLAND,4626,ØYGARDEN,60.628999,4.801797,Østers,PEDERSEN  JAN PER,https://sikker.fiskeridir.no/aquareg/web/sites/10062,H-ØN-0304,COMMERCIAL,Akvakulturdyr til konsum,208414,10062 PARISVATNET,"Bløtdyr, krepsdyr, pigghuder",,4.801797000000022,60.62899900000002
10071,TOSKASUNDET,KLARERT,"mai 6, 1999",PERMANENT,30,DA,SJØ,SALTVANN,VESTLAND,4631,ALVER,60.653536,4.956108,Kamskjell,HELLAND SKJELL AS,https://sikker.fiskeridir.no/aquareg/web/sites/10071,H-R-0308,COMMERCIAL,Akvakulturdyr til konsum,208415,10071 TOSKASUNDET,"Bløtdyr, krepsdyr, pigghuder",,4.956107999999972,60.653535999999974
10076,RYLANDSVÅG,KLARERT,"desember 7, 1993",PERMANENT,11500000,STK,LAND,FERSKVANN,VESTLAND,4631,ALVER,60.561573,5.044073,"Laks, Regnbueørret, Ørret",SALAR BRUK AS,https://sikker.fiskeridir.no/aquareg/web/sites/10076,H-ML-0003,COMMERCIAL,Settefisk,208416,10076 RYLANDSVÅG,"Settefisk laks, ørret, regnbueørret",,5.044073000000026,60.56157300000001
10077,TVEITEVÅG,KLARERT,"mars 11, 1999",PERMANENT,1000000,STK,LAND,FERSKVANN/SALTVANN,VESTLAND,4627,ASKØY,60.445729,5.133024,"Laks, Regnbueørret, Ørret",MOWI ASA,https://sikker.fiskeridir.no/aquareg/web/sites/10077,"H-K-0022, H-K-0021, ST-B-0008, H-A-0001",COMMERCIAL,"Settefisk, Stamfisk",208417,10077 TVEITEVÅG,"Settefisk laks, ørret, regnbueørret",,5.133023999999978,60.44572899999997
10078,MJÅNES,KLARERT,"april 12, 2000",PERMANENT,2340,TN,SJØ,SALTVANN,VESTLAND,4635,GULEN,60.997733,5.0304,"Laks, Regnbueørret, Ørret",FIRDA SJØFARMER AS,https://sikker.fiskeridir.no/aquareg/web/sites/10078,"SF-G-0010, SF-G-0038, SF-G-0011, SF-G-0009",COMMERCIAL,Matfisk,208418,10078 MJÅNES,"Matfisk laks, ørret, regnbueørret",,5.030399999999986,60.99773299999998
10080,LAKSEVIKA,KLARERT,"august 6, 1997",PERMANENT,1560,TN,SJØ,SALTVANN,VESTLAND,4631,ALVER,60.53015,5.11575,"Laks, Regnbueørret, Ørret",BLOM FISKEOPPDRETT AS,https://sikker.fiskeridir.no/aquareg/web/sites/10080,"H-ØN-0036, H-R-0011, H-ØN-0004, H-R-0008, H-R-0004, H-ML-0001, H-L-0019, H-ØN-0001","COMMERCIAL, EXHIBITION",Matfisk,208419,10080 LAKSEVIKA,"Matfisk laks, ørret, regnbueørret",,5.115749999999991,60.53014999999999
10086,REKEVIKI,KLARERT,"juni 25, 1991",PERMANENT,3120,TN,SJØ,SALTVANN,VESTLAND,4631,ALVER,60.723417,5.328583,"Laks, Regnbueørret, Ørret",BLOM FISKEOPPDRETT AS,https://sikker.fiskeridir.no/aquareg/web/sites/10086,"H-R-0011, H-ØN-0004, H-R-0008, H-R-0004, H-ML-0001, H-L-0019, H-ØN-0001",COMMERCIAL,Matfisk,208420,10086 REKEVIKI,"Matfisk laks, ørret, regnbueørret",,5.3285829999999805,60.72341699999998
10087,KALVØYA N,KLARERT,"mai 30, 1996",PERMANENT,1560,TN,SJØ,SALTVANN,VESTLAND,4645,ASKVOLL,61.32,4.708333,"Laks, Regnbueørret, Ørret",LANDØY FISKEOPPDRETT AS,https://sikker.fiskeridir.no/aquareg/web/sites/10087,"SF-A-0032, SF-A-0006, SF-A-0026",COMMERCIAL,Matfisk,208421,10087 KALVØYA N,"Matfisk laks, ørret, regnbueørret",,4.708332999999982,61.31999999999999
10090,TRELLEVIKA,KLARERT,"juli 2, 2014",PERMANENT,2340,TN,SJØ,SALTVANN,VESTLAND,4645,ASKVOLL,61.370383,5.0185,"Laks, Regnbueørret, Ørret",FIRDA SJØFARMER AS,https://sikker.fiskeridir.no/aquareg/web/sites/10090,"SF-G-0010, SF-G-0002, SF-G-0006, SF-G-0011, SF-G-0022, SF-G-0038, SF-A-0030, SF-N-0001, SF-A-0031, SF-G-0005, SF-H-0001, SF-H-0003, SF-G-0009",COMMERCIAL,Matfisk,208422,10090 TRELLEVIKA,"Matfisk laks, ørret, regnbueørret",,5.018500000000017,61.370383000000004
10091,VÅGSØYA,KLARERT,"mai 2, 2012",PERMANENT,1560,TN,SJØ,SALTVANN,VESTLAND,4602,KINN,61.490383,5.0247,Regnbueørret,SVANØY HAVBRUK AS,https://sikker.fiskeridir.no/aquareg/web/sites/10091,"SF-F-0053, SF-F-0057, SF-F-0013","COMMERCIAL, RESEARCH","Matfisk, Stamfisk",208423,10091 VÅGSØYA,Særtillatelser,,5.024699999999996,61.49038300000001
10110,DJUPEVIK,KLARERT,"juni 11, 1993",PERMANENT,5460,TN,SJØ,SALTVANN,ROGALAND,1103,STAVANGER,59.1474,5.863783,"Laks, Regnbueørret, Ørret","FINNØY FISK AS, MOWI ASA",https://sikker.fiskeridir.no/aquareg/web/sites/10110,"R-F-0003, R-V-0011, R-F-0030, R-F-0001, R-HM-0001, R-F-0005",COMMERCIAL,Matfisk,208424,10110 DJUPEVIK,"Matfisk laks, ørret, regnbueørret",,5.863783000000012,59.147400000000005
10113,KOBBAVIKA,KLARERT,"juni 18, 1998",PERMANENT,3600,TN,SJØ,SALTVANN,ROGALAND,1103,STAVANGER,59.122317,5.934433,"Laks, Regnbueørret, Ørret","CENTRE FOR AQUACULTURE COMPETENCE AS, MOWI ASA",https://sikker.fiskeridir.no/aquareg/web/sites/10113,"R-HM-0002, R-F-0003, R-HM-0033, R-ST-0001, R-HM-0020, R-HM-0001","COMMERCIAL, RESEARCH",Matfisk,208425,10113 KOBBAVIKA,"Matfisk laks, ørret, regnbueørret",,5.934433000000013,59.12231700000001
10114,IMS IV,KLARERT,"februar 27, 1996",PERMANENT,40,M3,LAND,FERSKVANN/SALTVANN,ROGALAND,1108,SANDNES,58.900978,5.962048,"Laks, Regnbueørret, Ørret",STIFTELSEN NORSK INSTITUTT FOR NATURFORSKNING NINA,https://sikker.fiskeridir.no/aquareg/web/sites/10114,R-SS-0022,RESEARCH,Matfisk,208426,10114 IMS IV,Særtillatelser,,5.962047999999982,58.90097800000001
10123,FISTER,KLARERT,"oktober 29, 1998",PERMANENT,5000000,STK,LAND,FERSKVANN,ROGALAND,1133,HJELMELAND,59.177482,6.067085,"Laks, Regnbueørret, Ørret",FISTER SMOLT AS,https://sikker.fiskeridir.no/aquareg/web/sites/10123,R-HM-0004,COMMERCIAL,Settefisk,208427,10123 FISTER,"Settefisk laks, ørret, regnbueørret",,6.06708500000002,59.177482
10126,VASSVIK,KLARERT,"juni 18, 1998",PERMANENT,1560,TN,SJØ,SALTVANN,ROGALAND,1133,HJELMELAND,59.215433,6.097567,Kveite,STERLING WHITE HALIBUT AS,https://sikker.fiskeridir.no/aquareg/web/sites/10126,"R-HM-0018, R-HM-0031",COMMERCIAL,Matfisk,208428,10126 VASSVIK,Andre,,6.097567000000026,59.21543300000002
10131,DIRDAL,KLARERT,"oktober 30, 1991",PERMANENT,600000,STK,LAND,FERSKVANN/SALTVANN,ROGALAND,1122,GJESDAL,58.838616,6.184203,"Breiflabb, Flekksteinbit, Gråsteinbit, Kveite, Laks, Piggvar, Regnbueørret, Rødspette, Torsk, Tunge, Ørret",EWOS INNOVATION AS,https://sikker.fiskeridir.no/aquareg/web/sites/10131,"R-G-0008, R-G-0007",COMMERCIAL,"Matfisk, Settefisk",208429,10131 DIRDAL,"Matfisk laks, ørret, regnbueørret",,6.184203000000025,58.838616
10136,ONARØY,KLARERT,"september 22, 1993",PERMANENT,3900,TN,SJØ,SALTVANN,VESTLAND,4616,TYSNES,59.95335,5.669683,"Laks, Regnbueørret, Ørret","FJELBERG FJORDBRUK  AS, NORDSJØ FJORDBRUK AS, SUNNHORDLAND FJORDBRUK AS, TYSNES FJORDBRUK AS",https://sikker.fiskeridir.no/aquareg/web/sites/10136,"H-B-0006, H-T-0020, H-E-0001, H-K-0035, H-B-0029, H-T-0016, H-T-0006, H-K-0013, H-T-0003",COMMERCIAL,Matfisk,208430,10136 ONARØY,"Matfisk laks, ørret, regnbueørret",,5.6696830000000205,59.95335
10137,MATLAND,KLARERT,"februar 10, 1997",PERMANENT,780,TN,SJØ,SALTVANN,VESTLAND,4624,BJØRNAFJORDEN,60.264083,5.6591,Laks,AS BOLAKS,https://sikker.fiskeridir.no/aquareg/web/sites/10137,"H-FS-0026, H-FS-0040",COMMERCIAL,Stamfisk,208431,10137 MATLAND,"Stamfisk laks, ørret, regnbueørret",,5.659100000000024,60.26408300000003
10141,SÆVAREID,KLARERT,"januar 8, 1993",PERMANENT,0,STK,LAND,FERSKVANN,VESTLAND,4624,BJØRNAFJORDEN,60.189017,5.763817,"Laks, Regnbueørret, Ørret",AS SÆVAREID FISKEANLEGG,https://sikker.fiskeridir.no/aquareg/web/sites/10141,"H-FS-0015, H-FS-0018",COMMERCIAL,Settefisk,208432,10141 SÆVAREID,"Settefisk laks, ørret, regnbueørret",,5.763817000000017,60.18901699999998
10145,UTLEBØEN,KLARERT,"januar 14, 2000",PERMANENT,15,TN,LAND,FERSKVANN,VESTLAND,4624,BJØRNAFJORDEN,60.226185,5.873078,"Laks, Regnbueørret, Ørret",BOLSTAD BRUK AS,https://sikker.fiskeridir.no/aquareg/web/sites/10145,H-FS-0039,COMMERCIAL,Settefisk,208433,10145 UTLEBØEN,"Settefisk laks, ørret, regnbueørret",,5.873078000000021,60.22618499999999
10147,TUNGESVIK,KLARERT,"august 13, 1992",PERMANENT,1235,TN,SJØ,SALTVANN,VESTLAND,4611,ETNE,59.741933,5.98095,Laks,MOWI ASA,https://sikker.fiskeridir.no/aquareg/web/sites/10147,"H-K-0022, H-K-0021",COMMERCIAL,Stamfisk,208434,10147 TUNGESVIK,"Stamfisk laks, ørret, regnbueørret",,5.980950000000007,59.74193300000002
10149,RAFDAL,KLARERT,"juli 2, 1997",PERMANENT,1235,TN,SJØ,SALTVANN,VESTLAND,4611,ETNE,59.790017,6.175783,Laks,MOWI ASA,https://sikker.fiskeridir.no/aquareg/web/sites/10149,"H-K-0022, H-K-0021",COMMERCIAL,Stamfisk,208435,10149 RAFDAL,"Stamfisk laks, ørret, regnbueørret",,6.175783000000024,59.79001699999998
10156,MATREDAL,KLARERT,"oktober 9, 1997",PERMANENT,400000,STK,LAND,FERSKVANN/SALTVANN,VESTLAND,4634,MASFJORDEN,60.874205,5.586388,"Berggylt, Bergnebb, Blåskjell, Blåstål, Breiflabb, Dorade, Dypvannsreke, Flekksteinbit, Gressgylt, Grønngylt, Havabbor, Hestmakrell, Hummer, Hyse, Kamskjell, Krinakrabbe, uspes., Kveite, Laks, Makrell, Muddertrollkreps, uspes., Norsk storkrill, Piggvar, Regnbueørret, Rognkjeks (felles), Røye, Sei, Sild, Taskekrabbe, Torsk, Ørret, Østers",HAVFORSKNINGSINSTITUTTET,https://sikker.fiskeridir.no/aquareg/web/sites/10156,"H-MF-0024, H-MF-0028, H-MF-0316, H-MF-0001",COMMERCIAL,"Akvakulturdyr til konsum, Matfisk, Settefisk",208436,10156 MATREDAL,"Matfisk laks, ørret, regnbueørret",,5.5863879999999995,60.87420500000002
10170,SANDE,KLARERT,"oktober 21, 1991",PERMANENT,5000000,STK,LAND,FERSKVANN,VESTLAND,4650,GLOPPEN,61.779717,6.12425,"Laks, Regnbueørret, Ørret",SANDE SETTEFISK AS,https://sikker.fiskeridir.no/aquareg/web/sites/10170,SF-GP-0002,COMMERCIAL,Settefisk,208437,10170 SANDE,"Settefisk laks, ørret, regnbueørret",,6.124250000000018,61.779717000000005
10173,SOLBERGSTRAND,KLARERT,"februar 10, 1999",PERMANENT,3.7,TN,LAND,FERSKVANN/SALTVANN,VIKEN,3022,FROGN,59.615783,10.65265,"Berggylt, Bergnebb, Bernakeremittkreps, Blomsterreke, Blåstål, Brungylt, Dverghummer, Dvergreke, Dvergsvømmekrabbe, Dypvannsreke, Gapeflyndre, Gitarpyntekrabbe, Gressgylt, Grønngylt, Havabbor, Hestereke, Hummer, Kamuflasjereke, Krinakrabbe, uspes., Kveite, Laks, Langfotkrabbe, Marmorkrabbe, Muddertrollkreps, Piggvar, Porselenskrabbe, Regnbueørret, Rettsnutet svømmekrabbe, Rognkjeks (felles), Rødspette, Sandflyndre, Sandpyntekrabbe, Sjøgressreke, Sjøkreps, Skrubbe, Smørflyndre, Stankelbenkrabbe, Steinkrabbe, Strandkrabbe, Strandreke, Taskekrabbe, Torsk, Trepigget stingsild, Trollkrabbe, Tunge, Vanlig svømmekrabbe, Ørret",NORSK INSTITUTT FOR VANNFORSKNING,https://sikker.fiskeridir.no/aquareg/web/sites/10173,"A-F-0303, A-F-0002, A-F-0001, A-F-0003, A-F-0004, A-F-0302","COMMERCIAL, RESEARCH","Akvakulturdyr i tidlige livsstadier, Matfisk, Settefisk, Stamdyr, Stamfisk",208438,10173 SOLBERGSTRAND,Særtillatelser,,10.652649999999994,59.61578300000002
10181,OKSEBÅSEN V,KLARERT,"oktober 20, 1997",PERMANENT,4680,TN,SJØ,SALTVANN,MØRE OG ROMSDAL,1532,GISKE,62.52025,6.16075,"Laks, Regnbueørret, Ørret",MOWI ASA,https://sikker.fiskeridir.no/aquareg/web/sites/10181,"M-S-0001, M-SM-0001, M-S-0003, M-SM-0015, M-G-0001, M-HØ-0002",COMMERCIAL,Matfisk,208439,10181 OKSEBÅSEN V,"Matfisk laks, ørret, regnbueørret",,6.160750000000007,62.520249999999976
10183,BARSTADVIK,KLARERT,"september 10, 1998",PERMANENT,780,TN,LAND,SALTVANN,MØRE OG ROMSDAL,1520,ØRSTA,62.359983,6.263517,"Laks, Regnbueørret, Ørret",AQUAGEN AS,https://sikker.fiskeridir.no/aquareg/web/sites/10183,"M-TV-0009, M-SU-0001, M-VD-0042",COMMERCIAL,"Settefisk, Stamfisk",208440,10183 BARSTADVIK,"Settefisk laks, ørret, regnbueørret",,6.263516999999979,62.359983
10191,VESTREFJORDEN,KLARERT,"april 24, 1996",PERMANENT,0,STK,LAND,FERSKVANN,MØRE OG ROMSDAL,1507,ÅLESUND,62.626961,6.662294,"Laks, Regnbueørret, Ørret",RAUMA EIK AS,https://sikker.fiskeridir.no/aquareg/web/sites/10191,M-H-0017,COMMERCIAL,Settefisk,208441,10191 VESTREFJORDEN,"Settefisk laks, ørret, regnbueørret",,6.662293999999974,62.626960999999994
10194,HELLAREN,KLARERT,"mai 29, 1995",PERMANENT,780,TN,SJØ,SALTVANN,MØRE OG ROMSDAL,1506,MOLDE,62.735833,6.74745,"Laks, Regnbueørret, Ørret",AS ØYLAKS,https://sikker.fiskeridir.no/aquareg/web/sites/10194,M-MD-0003,COMMERCIAL,Matfisk,208442,10194 HELLAREN,"Matfisk laks, ørret, regnbueørret",,6.747450000000015,62.735833000000014
10195,FORNESET,KLARERT,"oktober 10, 1997",PERMANENT,65,TN,LAND,SALTVANN,MØRE OG ROMSDAL,1506,MOLDE,62.68455,6.799283,Kveite,NORDIC HALIBUT AS,https://sikker.fiskeridir.no/aquareg/web/sites/10195,"M-MD-0016, M-MD-0021",COMMERCIAL,"Settefisk, Stamfisk",208443,10195 FORNESET,Andre,,6.799283000000003,62.68455
10204,HENDNESET,KLARERT,"juni 25, 1991",PERMANENT,428.74,TN,LAND,SALTVANN,MØRE OG ROMSDAL,1554,AVERØY,63.0601,7.511167,Kveite,NORDIC HALIBUT AS,https://sikker.fiskeridir.no/aquareg/web/sites/10204,M-AV-0023,COMMERCIAL,Matfisk,208444,10204 HENDNESET,Andre,,7.511167,63.06009999999998
10212,BOGEN,KLARERT,"juni 2, 1994",PERMANENT,6240,TN,SJØ,SALTVANN,MØRE OG ROMSDAL,1505,KRISTIANSUND,63.076783,7.9046,"Laks, Regnbueørret, Ørret",LERØY MIDT AS,https://sikker.fiskeridir.no/aquareg/web/sites/10212,"M-FI-0006, M-FI-0004, M-M-0002, M-N-0006, M-FI-0005, M-SM-0008, M-M-0001, M-FI-0003",COMMERCIAL,Matfisk,208445,10212 BOGEN,"Matfisk laks, ørret, regnbueørret",,7.904600000000016,63.07678299999998
10213,NAUSTNESET,KLARERT,"august 7, 1997",PERMANENT,2340,TN,SJØ,SALTVANN,MØRE OG ROMSDAL,1557,GJEMNES,62.9424,8.0756,"Laks, Regnbueørret, Ørret","LERØY MIDT AS, NOFIMA AS",https://sikker.fiskeridir.no/aquareg/web/sites/10213,"M-FI-0006, TR-SI-0001, ST-SI-0021, M-FI-0004, ST-SI-0020, M-FI-0005, M-FI-0003","COMMERCIAL, RESEARCH",Matfisk,208446,10213 NAUSTNESET,"Matfisk laks, ørret, regnbueørret",,8.075600000000009,62.94240000000002
10216,SKÅREN,KLARERT,"april 24, 1996",PERMANENT,3120,TN,SJØ,SALTVANN,TRØNDELAG,5055,HEIM,63.076283,8.191733,"Laks, Regnbueørret, Ørret",LERØY MIDT AS,https://sikker.fiskeridir.no/aquareg/web/sites/10216,"M-AV-0002, M-AV-0005, M-HS-0009",COMMERCIAL,"Matfisk, Stamfisk",208447,10216 SKÅREN,"Matfisk laks, ørret, regnbueørret",,8.191733,63.07628299999999
10220,BOTN,KLARERT,"januar 7, 1999",PERMANENT,2500000,STK,LAND,FERSKVANN,TRØNDELAG,5055,HEIM,63.099227,8.625597,"Laks, Regnbueørret, Ørret",LERØY MIDT AS,https://sikker.fiskeridir.no/aquareg/web/sites/10220,M-HS-0006,COMMERCIAL,Settefisk,208448,10220 BOTN,"Settefisk laks, ørret, regnbueørret",,8.625597000000027,63.099226999999985
10221,AUNVÅGEN,KLARERT,"oktober 10, 1997",PERMANENT,2500000,STK,LAND,FERSKVANN,MØRE OG ROMSDAL,1573,SMØLA,63.449723,7.983361,"Laks, Regnbueørret, Ørret",NEKTON SETTEFISK AS,https://sikker.fiskeridir.no/aquareg/web/sites/10221,M-SM-0016,COMMERCIAL,Settefisk,208449,10221 AUNVÅGEN,"Settefisk laks, ørret, regnbueørret",,7.983361000000002,63.449723000000006
10223,BREMNESSVAET,KLARERT,"mai 9, 1995",PERMANENT,7020,TN,SJØ,SALTVANN,MØRE OG ROMSDAL,1573,SMØLA,63.39795,8.214317,"Laks, Regnbueørret, Ørret",MOWI ASA,https://sikker.fiskeridir.no/aquareg/web/sites/10223,"M-SM-0010, M-AV-0018, M-AV-0004, M-SM-0009, M-SM-0017, M-SM-0006, M-AV-0006, M-AV-0007, M-SM-0002, M-SM-0013",COMMERCIAL,Matfisk,208450,10223 BREMNESSVAET,"Matfisk laks, ørret, regnbueørret",,8.214316999999994,63.39794999999998
10224,KORSNESET,KLARERT,"desember 7, 1995",PERMANENT,4680,TN,SJØ,SALTVANN,TRØNDELAG,5055,HEIM,63.142683,8.225383,"Laks, Regnbueørret, Ørret","NORSK SJØMAT OPPDRETT AS, SALMAR FARMING AS",https://sikker.fiskeridir.no/aquareg/web/sites/10224,"M-AE-0005, M-AE-0014, M-ST-0008, M-AE-0022, M-HS-0011, M-SM-0014, M-AV-0009",COMMERCIAL,Matfisk,208451,10224 KORSNESET,"Matfisk laks, ørret, regnbueørret",,8.225383000000022,63.14268299999998
10229,FÆTTEN,KLARERT,"september 8, 2009",PERMANENT,4680,TN,SJØ,SALTVANN,TRØNDELAG,5055,HEIM,63.144583,8.459567,"Laks, Regnbueørret, Ørret",LERØY MIDT AS,https://sikker.fiskeridir.no/aquareg/web/sites/10229,"M-AK-0001, M-MD-0001, M-HS-0001, M-HS-0002, M-AE-0004, M-AE-0001",COMMERCIAL,Matfisk,208452,10229 FÆTTEN,"Matfisk laks, ørret, regnbueørret",,8.459566999999993,63.14458300000001
10231,STORVIK,KLARERT,"oktober 9, 1997",PERMANENT,200000,STK,LAND,FERSKVANN,MØRE OG ROMSDAL,1576,AURE,63.21297,8.542588,"Laks, Regnbueørret, Ørret",ERTVAAG SETTEFISK AS,https://sikker.fiskeridir.no/aquareg/web/sites/10231,M-AE-0010,COMMERCIAL,Settefisk,208453,10231 STORVIK,"Settefisk laks, ørret, regnbueørret",,8.542588000000023,63.212969999999984
10232,MANNBRUHOLMEN,KLARERT,"januar 14, 1998",PERMANENT,7020,TN,SJØ,SALTVANN,TRØNDELAG,5014,FRØYA,63.8473,8.53675,"Laks, Regnbueørret, Ørret",MOWI ASA,https://sikker.fiskeridir.no/aquareg/web/sites/10232,"ST-F-0012, ST-F-0009, ST-F-0011, ST-F-0001, ST-F-0002, ST-F-0032, ST-H-0047, ST-F-0015, ST-F-0029",COMMERCIAL,Matfisk,208454,10232 MANNBRUHOLMEN,"Matfisk laks, ørret, regnbueørret",,8.536749999999984,63.84730000000002
10240,ILSØYA Ø,KLARERT,"juni 16, 1998",PERMANENT,1560,TN,SJØ,SALTVANN,TRØNDELAG,5056,HITRA,63.651975,8.88687,"Laks, Regnbueørret, Ørret",AS KNUTSHAUGFISK,https://sikker.fiskeridir.no/aquareg/web/sites/10240,"ST-H-0007, ST-H-0009, ST-H-0055",COMMERCIAL,Matfisk,208456,10240 ILSØYA Ø,"Matfisk laks, ørret, regnbueørret",,8.886869999999988,63.65197499999999
10246,LEIKVANGBUKTA LAND,KLARERT,"februar 15, 1999",PERMANENT,300,TN,LAND,FERSKVANN/SALTVANN,TRØNDELAG,5057,ØRLAND,63.86205,9.861967,Laks,MOWI ASA,https://sikker.fiskeridir.no/aquareg/web/sites/10246,"N-SF-0019, ST-B-0008, ST-B-0015, ST-B-0014, N-B-0047",COMMERCIAL,Stamfisk,208457,10246 LEIKVANGBUKTA LAND,"Stamfisk laks, ørret, regnbueørret",,9.861966999999993,63.86205000000001
10247,HOMMELVIKA,KLARERT,"september 16, 1999",PERMANENT,300,TN,SJØ,SALTVANN,TRØNDELAG,5058,ÅFJORD,63.898267,10.004283,Blåskjell,FOSEN SKJELL AS,https://sikker.fiskeridir.no/aquareg/web/sites/10247,ST-AA-0337,COMMERCIAL,Akvakulturdyr til konsum,208458,10247 HOMMELVIKA,"Bløtdyr, krepsdyr, pigghuder",,10.004282999999987,63.898266999999976
10248,EIDSKJÆRA NØ,KLARERT,"august 21, 1998",PERMANENT,60,DA,SJØ,SALTVANN,TRØNDELAG,5058,ÅFJORD,63.954183,10.085183,Blåskjell,NORGESKJELL AS,https://sikker.fiskeridir.no/aquareg/web/sites/10248,ST-AA-0345,COMMERCIAL,Akvakulturdyr til konsum,208459,10248 EIDSKJÆRA NØ,"Bløtdyr, krepsdyr, pigghuder",,10.085182999999972,63.954183
10256,BONDØYA,KLARERT,"september 18, 1998",PERMANENT,4680,TN,SJØ,SALTVANN,TRØNDELAG,5060,NÆRØYSUND,64.8168,10.7427,"Laks, Regnbueørret, Ørret",SALMONOR AS,https://sikker.fiskeridir.no/aquareg/web/sites/10256,"NT-V-0041, TR-NR-0012, NT-V-0002, NT-NR-0049, NT-NR-0014, NT-V-0003, NT-NR-0056, TR-NR-0011","COMMERCIAL, EXHIBITION, RESEARCH",Matfisk,208460,10256 BONDØYA,"Matfisk laks, ørret, regnbueørret",,10.742700000000013,64.8168
10262,LILLE KVITHOLMEN,KLARERT,"mars 23, 1998",PERMANENT,4680,TN,SJØ,SALTVANN,TRØNDELAG,5060,NÆRØYSUND,65.01145,11.6139,"Laks, Regnbueørret, Ørret","BJØRØYA AS, MIDT-NORSK HAVBRUK AS, SALMONOR AS",https://sikker.fiskeridir.no/aquareg/web/sites/10262,"NT-F-0028, NT-V-0035, NT-NR-0055, NT-V-0002, NT-V-0027, NT-NR-0049, NT-NR-0041, NT-NR-0010, NT-V-0038, NT-NR-0014, NT-NR-0002, NT-V-0003",COMMERCIAL,Matfisk,208461,10262 LILLE KVITHOLMEN,"Matfisk laks, ørret, regnbueørret",,11.613900000000001,65.01145000000002
10265,KONGSMOELVA,KLARERT,"november 15, 1991",PERMANENT,1500000,STK,LAND,FERSKVANN,TRØNDELAG,5046,HØYLANDET,64.88412,12.436154,"Laks, Regnbueørret, Ørret",MOWI ASA,https://sikker.fiskeridir.no/aquareg/web/sites/10265,NT-H-0002,COMMERCIAL,Settefisk,208462,10265 KONGSMOELVA,"Settefisk laks, ørret, regnbueørret",,12.436153999999988,64.88412
10275,AUSKARNES Ø,KLARERT,"juni 27, 2001",PERMANENT,2700,TN,SJØ,SALTVANN,TROMS OG FINNMARK,5432,LOPPA,70.14145,22.3542,"Laks, Regnbueørret, Ørret",GRIEG SEAFOOD FINNMARK AS,https://sikker.fiskeridir.no/aquareg/web/sites/10275,"F-L-0033, F-L-0026, F-HV-0006, F-L-0022, F-L-0025",COMMERCIAL,Matfisk,208463,10275 AUSKARNES Ø,"Matfisk laks, ørret, regnbueørret",,22.35419999999999,70.14145000000002
10276,SOMMARBUKT,KLARERT,"april 17, 1996",PERMANENT,2580,TN,SJØ,SALTVANN,TROMS OG FINNMARK,5403,ALTA,70.077333,22.66705,"Laks, Regnbueørret, Ørret",CERMAQ NORWAY AS,https://sikker.fiskeridir.no/aquareg/web/sites/10276,"F-A-0036, F-A-0064, F-A-0011, F-KD-0031, F-A-0065","COMMERCIAL, RESEARCH",Matfisk,208464,10276 SOMMARBUKT,"Matfisk laks, ørret, regnbueørret",,22.667050000000017,70.07733300000001
10281,STORE KVALFJORD,KLARERT,"juni 27, 2001",PERMANENT,3600,TN,SJØ,SALTVANN,TROMS OG FINNMARK,5403,ALTA,70.321117,22.896517,"Laks, Regnbueørret, Ørret",NRS FARMING AS,https://sikker.fiskeridir.no/aquareg/web/sites/10281,"F-LB-0013, F-A-0056, F-A-0045, F-A-0057, F-LB-0014, F-A-0004",COMMERCIAL,Matfisk,208465,10281 STORE KVALFJORD,"Matfisk laks, ørret, regnbueørret",,22.896517000000017,70.32111700000002
10287,KVERNAVIKA,KLARERT,"september 24, 2001",PERMANENT,0,STK,LAND,FERSKVANN/SALTVANN,VESTLAND,4626,ØYGARDEN,60.21695,5.047933,"Laks, Regnbueørret, Ørret",BLOM SETTEFISK AS,https://sikker.fiskeridir.no/aquareg/web/sites/10287,H-S-0009,COMMERCIAL,Settefisk,208466,10287 KVERNAVIKA,"Settefisk laks, ørret, regnbueørret",,5.0479330000000004,60.21695
10289,ANDAREVÅGEN,KLARERT,"april 17, 2001",PERMANENT,9.8,DA,SJØ,SALTVANN,VESTLAND,4613,BØMLO,59.773483,5.109083,"Kamskjell, Østers",MAGNUS Å MELING,https://sikker.fiskeridir.no/aquareg/web/sites/10289,H-B-0349,COMMERCIAL,Akvakulturdyr til konsum,208467,10289 ANDAREVÅGEN,"Bløtdyr, krepsdyr, pigghuder",,5.109082999999998,59.773483
10291,HISKHOLMEN,KLARERT,"april 18, 2000",PERMANENT,2340,TN,SJØ,SALTVANN,VESTLAND,4613,BØMLO,59.72585,5.144717,"Laks, Regnbueørret, Ørret","ALLER AQUA NORWAY AS, FYLKESNES FISK AS",https://sikker.fiskeridir.no/aquareg/web/sites/10291,"H-FJ-0005, H-B-0046, H-B-0009, H-FJ-0029, H-FJ-0030, H-B-0021","COMMERCIAL, RESEARCH",Matfisk,208468,10291 HISKHOLMEN,"Matfisk laks, ørret, regnbueørret",,5.144717000000014,59.72584999999998
